{
 "doc_id": "livermore-budget-fy2026-2027",
 "height": 792.0,
 "page": 66,
 "schema_version": 1,
 "width": 612.0,
 "words": [
  [216.84,2.88,293.18,30.27,"BUDGET"],
  [298.69,2.88,397.2,30.27,"SUMMARY"],
  [79.66,32.61,149.93,52.67,"REVENUES,"],
  [153.92,32.61,251.33,52.67,"EXPENDITURES,"],
  [255.19,32.61,285.78,52.67,"AND"],
  [289.63,32.61,325.62,52.67,"FUND"],
  [329.47,32.61,466.77,52.67,"BALANCE/WORKING"],
  [470.7,32.61,526.07,52.67,"CAPITAL"],
  [188.52,74.36,241.06,86.39,"CITYWIDE"],
  [244.06,74.36,306.36,86.39,"REVENUES,"],
  [309.36,74.36,396.09,86.39,"EXPENDITURES,"],
  [399.1,74.36,422.21,86.39,"AND"],
  [210.12,87.92,240.05,99.95,"FUND"],
  [243.05,87.92,351.64,99.95,"BALANCE/WORKING"],
  [354.64,87.92,400.74,99.95,"CAPITAL"],
  [339.6,125.91,372.13,137.85,"General"],
  [374.56,125.91,395.62,137.85,"Fund"],
  [459.86,125.91,502.61,137.85,"Enterprise"],
  [505.17,125.91,530.14,137.85,"Funds"],
  [322.08,144.15,353.09,154.18,"Budget"],
  [382.2,144.15,413.21,154.18,"Budget"],
  [449.52,144.15,480.53,154.18,"Budget"],
  [509.64,144.15,540.65,154.18,"Budget"],
  [313.92,155.67,325.39,165.7,"FY"],
  [327.89,155.67,361.04,165.7,"2025-26"],
  [374.04,155.67,385.51,165.7,"FY"],
  [388.01,155.67,421.16,165.7,"2026-27"],
  [441.36,155.67,452.83,165.7,"FY"],
  [455.33,155.67,488.48,165.7,"2025-26"],
  [501.48,155.67,512.95,165.7,"FY"],
  [515.45,155.67,548.6,165.7,"2026-27"],
  [57.48,178.63,104.77,187.72,"REVENUES:"],
  [74.86,194.23,105.81,203.32,"Property"],
  [107.99,194.23,130.24,203.32,"Taxes"],
  [322.68,194.23,363.64,203.32,"64,143,762"],
  [382.78,194.23,423.64,203.32,"67,416,730"],
  [482.11,194.23,484.82,203.32,"-"],
  [542.13,194.23,544.84,203.32,"-"],
  [74.86,209.95,95.34,219.04,"Other"],
  [97.66,209.95,119.91,219.04,"Taxes"],
  [322.71,209.95,363.67,219.04,"23,800,196"],
  [382.72,209.95,423.67,219.04,"24,508,202"],
  [482.11,209.95,484.82,219.04,"-"],
  [542.13,209.95,544.84,219.04,"-"],
  [74.86,225.67,141.03,234.76,"Intergovernmental"],
  [327.26,225.67,363.6,234.76,"4,328,164"],
  [387.26,225.67,423.59,234.76,"4,631,220"],
  [482.11,225.67,484.82,234.76,"-"],
  [542.13,225.67,544.84,234.76,"-"],
  [74.86,241.39,105.81,250.48,"Charges"],
  [108.07,241.39,117.58,250.48,"for"],
  [119.9,241.39,151.26,250.48,"Services"],
  [327.23,241.39,363.57,250.48,"6,130,207"],
  [387.26,241.39,423.6,250.48,"6,179,158"],
  [450.24,241.39,491.1,250.48,"62,250,824"],
  [510.27,241.39,551.13,250.48,"64,332,646"],
  [74.86,257.11,89.34,266.2,"Use"],
  [91.61,257.11,98.39,266.2,"of"],
  [100.76,257.11,125.26,266.2,"Money"],
  [127.44,257.11,141.93,266.2,"And"],
  [144.19,257.11,175.16,266.2,"Property"],
  [327.19,257.11,363.53,266.2,"8,488,168"],
  [387.19,257.11,423.53,266.2,"9,771,259"],
  [454.76,257.11,491.1,266.2,"4,836,537"],
  [514.82,257.11,551.16,266.2,"5,749,704"],
  [74.86,272.83,123.0,281.92,"Contributions"],
  [125.26,272.83,167.53,281.92,"Outsourced"],
  [338.55,272.83,363.56,281.92,"76,360"],
  [398.53,272.83,423.54,281.92,"78,651"],
  [482.11,272.83,484.82,281.92,"-"],
  [542.13,272.83,544.84,281.92,"-"],
  [74.86,288.55,126.63,297.64,"Miscellaneous"],
  [128.89,288.55,161.65,297.64,"Revenue"],
  [327.15,288.55,363.54,297.64,"2,180,708"],
  [387.23,288.55,423.68,297.64,"2,205,271"],
  [461.55,288.55,491.21,297.64,"426,900"],
  [521.57,288.55,551.23,297.64,"225,900"],
  [74.86,304.27,95.24,313.36,"Sales"],
  [97.5,304.27,119.75,313.36,"Taxes"],
  [322.71,304.27,363.68,313.36,"41,086,606"],
  [382.73,304.27,423.71,313.36,"41,908,338"],
  [482.11,304.27,484.82,313.36,"-"],
  [542.13,304.27,544.84,313.36,"-"],
  [74.86,319.99,94.85,329.08,"Fines"],
  [97.19,319.99,102.62,329.08,"&"],
  [104.83,319.99,144.0,329.08,"Forfeitures"],
  [334.11,319.99,363.66,329.08,"386,500"],
  [394.12,319.99,423.65,329.08,"398,270"],
  [482.11,319.99,484.82,329.08,"-"],
  [542.13,319.99,544.84,329.08,"-"],
  [74.86,335.71,107.07,344.8,"Licenses"],
  [109.33,335.71,114.75,344.8,"&"],
  [117.02,335.71,144.7,344.8,"Permits"],
  [327.18,335.71,363.63,344.8,"7,252,799"],
  [387.21,335.71,423.65,344.8,"7,261,048"],
  [482.11,335.71,484.82,344.8,"-"],
  [542.13,335.71,544.84,344.8,"-"],
  [57.48,351.55,84.01,360.64,"TOTAL"],
  [86.36,351.55,133.72,360.64,"REVENUES:"],
  [315.97,351.55,365.99,360.64,"$157,873,470"],
  [375.96,351.55,426.0,360.64,"$164,358,147"],
  [447.77,351.55,493.25,360.64,"$67,514,261"],
  [507.78,351.55,553.29,360.64,"$70,308,250"],
  [334.11,367.15,363.77,376.24,"480,400"],
  [394.13,367.15,423.79,376.24,"486,735"],
  [450.08,367.15,490.94,376.24,"13,247,000"],
  [510.07,367.15,550.94,376.24,"13,330,000"],
  [59.74,367.27,103.66,376.36,"TRANSFER"],
  [105.93,367.27,116.78,376.36,"IN:"],
  [57.48,382.99,84.01,392.08,"TOTAL"],
  [86.36,382.99,126.56,392.08,"SOURCES"],
  [315.88,382.99,365.92,392.08,"$158,353,870"],
  [375.97,382.99,425.99,392.08,"$164,844,882"],
  [447.68,382.99,493.19,392.08,"$80,761,261"],
  [507.8,382.99,553.31,392.08,"$83,638,250"],
  [57.48,406.51,123.16,415.6,"EXPENDITURES:"],
  [344.76,407.47,375.15,416.56,"General"],
  [377.42,407.47,397.54,416.56,"Fund"],
  [461.32,407.47,501.77,416.56,"Enterprise"],
  [504.03,407.47,528.68,416.56,"Funds"],
  [74.86,422.11,100.78,431.2,"Wages"],
  [103.04,422.11,108.46,431.2,"&"],
  [110.68,422.11,140.2,431.2,"Benefits"],
  [322.72,422.11,363.59,431.2,"81,801,011"],
  [382.72,422.11,423.58,431.2,"83,825,633"],
  [449.88,422.11,490.86,431.2,"16,066,536"],
  [509.99,422.11,550.86,431.2,"16,515,484"],
  [74.86,437.83,106.25,446.92,"Services"],
  [108.51,437.83,113.94,446.92,"&"],
  [116.21,437.83,147.5,446.92,"Supplies"],
  [322.69,437.83,363.56,446.92,"62,849,791"],
  [382.72,437.83,423.59,446.92,"65,188,946"],
  [449.88,437.83,490.93,446.92,"39,593,240"],
  [509.98,437.83,550.96,446.92,"39,881,236"],
  [74.86,453.55,100.27,462.64,"Capital"],
  [102.53,453.55,126.13,462.64,"Outlay"],
  [354.52,453.55,357.24,462.64,"-"],
  [414.62,453.55,417.33,462.64,"-"],
  [461.3,453.55,490.85,462.64,"699,900"],
  [521.32,453.55,550.87,462.64,"453,900"],
  [74.86,469.27,92.06,478.36,"Debt"],
  [94.42,469.27,125.81,478.36,"Services"],
  [354.53,469.27,357.24,478.36,"-"],
  [414.64,469.27,417.35,478.36,"-"],
  [461.32,469.27,490.87,478.36,"694,054"],
  [521.35,469.27,550.89,478.36,"697,350"],
  [57.48,485.11,84.01,494.2,"TOTAL"],
  [86.36,485.11,152.02,494.2,"EXPENDITURES:"],
  [315.88,485.11,365.9,494.2,"$144,650,802"],
  [375.95,485.11,425.97,494.2,"$149,014,579"],
  [447.74,485.11,493.19,494.2,"$57,053,730"],
  [507.8,485.11,553.24,494.2,"$57,547,970"],
  [322.8,500.71,363.66,509.8,"10,037,797"],
  [382.83,500.71,423.69,509.8,"10,146,598"],
  [449.99,500.71,490.95,509.8,"19,813,147"],
  [510.08,500.71,550.95,509.8,"24,680,000"],
  [59.74,500.83,103.66,509.92,"TRANSFER"],
  [105.93,500.83,125.66,509.92,"OUT:"],
  [327.32,516.43,363.66,525.52,"4,699,425"],
  [387.38,516.43,423.72,525.52,"3,332,607"],
  [481.86,516.43,484.57,525.52,"-"],
  [541.89,516.43,544.6,525.52,"-"],
  [59.74,516.55,98.77,525.64,"ADDITION"],
  [100.97,516.55,112.1,525.64,"TO"],
  [114.47,516.55,158.59,525.64,"RESERVES"],
  [57.48,532.27,84.01,541.36,"TOTAL"],
  [86.36,532.27,111.14,541.36,"USES:"],
  [315.95,532.27,365.97,541.36,"$159,388,024"],
  [375.94,532.27,425.98,541.36,"$162,493,784"],
  [447.76,532.27,493.25,541.36,"$76,866,877"],
  [507.86,532.27,553.25,541.36,"$82,227,970"],
  [327.32,563.59,363.66,572.68,"1,766,613"],
  [394.17,563.59,423.72,572.68,"732,459"],
  [445.46,563.59,490.95,572.68,"103,394,450"],
  [505.46,563.59,550.96,572.68,"107,288,834"],
  [59.74,563.71,105.89,572.8,"BEGINNING"],
  [108.16,563.71,148.55,572.8,"WORKING"],
  [150.82,563.71,185.43,572.8,"CAPITAL"],
  [322.8,579.31,364.61,588.4,"(1,034,154)"],
  [387.35,579.31,423.74,588.4,"2,351,098"],
  [454.54,579.31,491.0,588.4,"3,894,384"],
  [514.57,579.31,550.96,588.4,"1,410,280"],
  [59.74,579.43,94.76,588.52,"CHANGE"],
  [96.98,579.43,105.22,588.52,"IN"],
  [107.42,579.43,147.87,588.52,"WORKING"],
  [150.14,579.43,184.75,588.52,"CAPITAL"],
  [57.48,593.47,89.09,602.56,"ENDING"],
  [91.36,593.47,131.74,602.56,"WORKING"],
  [134.01,593.47,168.6,602.56,"CAPITAL"],
  [331.75,593.47,365.93,602.56,"$732,459"],
  [385.03,593.47,425.89,602.56,"$3,083,557"],
  [443.11,593.47,493.14,602.56,"$107,288,834"],
  [503.19,593.47,553.21,602.56,"$108,699,114"],
  [242.02,741.98,293.82,761.99,"BUDGET"],
  [297.74,741.98,313.14,761.99,"FY"],
  [317.06,741.98,369.98,761.99,"2025-27"],
  [485.11,741.98,520.39,761.99,"Page"],
  [524.32,741.98,540.0,761.99,"62"]
 ]
}
