{
 "doc_id": "livermore-budget-fy2026-2027",
 "height": 792.0,
 "page": 130,
 "schema_version": 1,
 "width": 612.0,
 "words": [
  [257.85,0.45,354.05,27.79,"REVENUES"],
  [227.3,66.91,283.99,78.01,"Revenues"],
  [287.32,66.91,334.67,78.01,"Sources"],
  [338.01,66.91,352.01,78.01,"by"],
  [355.35,66.91,384.67,78.01,"Fund"],
  [267.34,80.3,312.02,91.4,"General"],
  [315.36,80.3,344.68,91.4,"Fund"],
  [350.5,106.22,385.01,114.54,"Revised"],
  [277.85,116.23,305.35,124.55,"Actual"],
  [352.3,116.23,383.29,124.55,"Budget"],
  [430.92,116.23,461.91,124.55,"Budget"],
  [508.32,116.23,539.31,124.55,"Budget"],
  [268.13,126.23,279.63,134.56,"FY"],
  [282.1,126.23,315.11,134.56,"2023-24"],
  [345.53,126.23,357.03,134.56,"FY"],
  [359.53,126.23,392.55,134.56,"2024-25"],
  [422.93,126.23,434.43,134.56,"FY"],
  [436.93,126.23,469.95,134.56,"2025-26"],
  [500.33,126.23,511.83,134.56,"FY"],
  [514.33,126.23,547.35,134.56,"2026-27"],
  [56.02,142.07,77.51,150.4,"Total"],
  [80.02,142.07,139.0,150.4,"Contributions"],
  [141.51,142.07,192.01,150.4,"Outsourced"],
  [291.24,142.07,323.76,150.4,"$72,038"],
  [398.16,142.07,401.16,150.4,"-"],
  [446.04,142.07,478.56,150.4,"$76,360"],
  [523.44,142.07,555.96,150.4,"$78,651"],
  [56.02,160.07,117.53,168.4,"Miscellaneous"],
  [120.03,160.07,157.54,168.4,"Revenue"],
  [86.04,178.07,104.05,186.4,"Sale"],
  [106.55,178.07,114.05,186.4,"of"],
  [116.56,178.07,147.06,186.4,"Surplus"],
  [149.56,178.07,183.57,186.4,"Property"],
  [303.77,178.07,323.78,186.4,"$366"],
  [391.18,178.07,401.18,186.4,"$0"],
  [468.58,178.07,478.58,186.4,"$0"],
  [545.98,178.07,555.98,186.4,"$0"],
  [86.04,196.07,126.04,204.4,"Cardroom"],
  [128.54,196.07,164.56,204.4,"Revenue"],
  [291.24,196.07,323.76,204.4,"417,696"],
  [368.64,196.07,401.16,204.4,"438,000"],
  [438.55,196.07,478.58,204.4,"1,359,600"],
  [515.95,196.07,555.98,204.4,"1,359,600"],
  [86.04,214.07,114.55,222.4,"Hosted"],
  [117.05,214.07,149.55,222.4,"Training"],
  [320.76,214.07,323.76,222.4,"-"],
  [386.14,214.07,401.15,222.4,"500"],
  [475.56,214.07,478.56,222.4,"-"],
  [552.96,214.07,555.96,222.4,"-"],
  [86.04,232.07,143.05,240.4,"Miscellaneous"],
  [145.55,232.07,181.56,240.4,"Revenue"],
  [291.24,232.07,323.76,240.4,"120,161"],
  [373.68,232.07,401.2,240.4,"80,500"],
  [446.04,232.07,478.56,240.4,"406,576"],
  [523.44,232.07,555.96,240.4,"418,549"],
  [86.04,250.07,98.04,258.4,"SB"],
  [100.55,250.07,120.56,258.4,"1383"],
  [123.06,250.07,143.07,258.4,"Fees"],
  [291.24,250.07,323.76,258.4,"210,980"],
  [368.64,250.07,401.16,258.4,"200,000"],
  [446.04,250.07,478.56,258.4,"217,309"],
  [523.44,250.07,555.96,258.4,"223,829"],
  [86.04,268.07,107.05,276.4,"Bond"],
  [109.55,268.07,151.56,276.4,"Monitoring"],
  [154.06,268.07,169.57,276.4,"Fee"],
  [296.28,268.07,323.8,276.4,"45,770"],
  [373.68,268.07,401.2,276.4,"45,000"],
  [451.08,268.07,478.6,276.4,"47,143"],
  [528.48,268.07,556.0,276.4,"48,557"],
  [86.04,286.07,105.04,294.4,"EDD"],
  [107.54,286.07,119.04,294.4,"Art"],
  [121.54,286.07,147.04,294.4,"Admin"],
  [149.55,286.07,165.05,294.4,"Fee"],
  [167.55,286.07,196.56,294.4,"Contrib"],
  [301.25,286.07,323.76,294.4,"6,425"],
  [373.68,286.07,401.2,294.4,"15,000"],
  [456.05,286.07,478.56,294.4,"6,617"],
  [533.45,286.07,555.96,294.4,"6,816"],
  [86.04,304.07,115.54,312.4,"Electric"],
  [118.04,304.07,147.55,312.4,"Vehicle"],
  [150.05,304.07,166.55,312.4,"Chg"],
  [169.06,304.07,184.56,312.4,"Fee"],
  [296.28,304.07,323.8,312.4,"17,000"],
  [378.65,304.07,401.16,312.4,"6,600"],
  [451.08,304.07,478.6,312.4,"17,510"],
  [528.48,304.07,556.0,312.4,"18,036"],
  [86.04,322.07,118.54,330.4,"LVWHD"],
  [121.04,322.07,160.54,330.4,"Collection"],
  [163.04,322.07,178.55,330.4,"Fee"],
  [296.28,322.07,323.8,330.4,"11,357"],
  [398.16,322.07,401.16,330.4,"-"],
  [451.08,322.07,478.6,330.4,"11,697"],
  [528.48,322.07,556.0,330.4,"12,048"],
  [86.04,340.07,110.54,348.4,"Urban"],
  [113.05,340.07,146.05,348.4,"Forestry"],
  [148.55,340.07,189.06,348.4,"Revenues"],
  [296.28,340.07,323.8,348.4,"99,665"],
  [378.65,340.07,401.16,348.4,"5,000"],
  [446.04,340.07,478.56,348.4,"102,655"],
  [523.44,340.07,555.96,348.4,"105,735"],
  [86.04,358.07,110.54,366.4,"POST"],
  [113.05,358.07,176.55,366.4,"Reimbursement"],
  [296.28,358.07,323.8,366.4,"20,939"],
  [373.68,358.07,401.2,366.4,"50,000"],
  [451.08,358.07,478.6,366.4,"11,000"],
  [528.48,358.07,556.0,366.4,"11,500"],
  [86.04,376.07,113.54,384.4,"Library"],
  [116.04,376.07,119.04,384.4,"-"],
  [121.54,376.07,173.05,384.4,"Merchandise"],
  [308.74,376.07,323.75,384.4,"601"],
  [386.14,376.07,401.15,384.4,"300"],
  [463.54,376.07,478.55,384.4,"601"],
  [540.94,376.07,555.95,384.4,"601"],
  [86.04,394.07,107.04,402.4,"Cash"],
  [109.55,394.07,153.06,402.4,"Over/Short"],
  [313.78,394.07,323.78,402.4,"19"],
  [398.16,394.07,401.16,402.4,"-"],
  [475.56,394.07,478.56,402.4,"-"],
  [552.96,394.07,555.96,402.4,"-"],
  [56.02,412.07,77.51,420.4,"Total"],
  [80.02,412.07,141.53,420.4,"Miscellaneous"],
  [144.04,412.07,181.54,420.4,"Revenue"],
  [286.27,412.07,323.8,420.4,"$950,978"],
  [363.67,412.07,401.2,420.4,"$840,900"],
  [433.51,412.07,478.54,420.4,"$2,180,708"],
  [510.91,412.07,555.94,420.4,"$2,205,271"],
  [173.38,430.07,194.87,438.4,"Total"],
  [197.38,430.07,230.89,438.4,"General"],
  [233.39,430.07,255.38,438.4,"Fund"],
  [268.7,430.07,323.74,438.4,"$142,028,002"],
  [346.1,430.07,401.14,438.4,"$148,800,148"],
  [423.5,430.07,478.54,438.4,"$157,873,470"],
  [500.9,430.07,555.94,438.4,"$164,358,147"],
  [242.02,741.98,293.82,761.99,"BUDGET"],
  [297.74,741.98,313.14,761.99,"FY"],
  [317.06,741.98,369.98,761.99,"2025-27"],
  [477.27,741.98,512.55,761.99,"Page"],
  [516.48,741.98,540.0,761.99,"126"]
 ]
}
