{
 "doc_id": "livermore-cip-fy2026-2030",
 "height": 792.0,
 "page": 83,
 "schema_version": 1,
 "width": 612.0,
 "words": [
  [7.26,22.37,43.74,40.37,"2024"],
  [47.81,22.37,110.76,40.37,"STREAM"],
  [114.82,22.37,228.69,40.37,"MAINTENANCE"],
  [232.76,22.37,252.18,40.37,"BY"],
  [256.24,22.37,368.96,40.37,"CONTRACTORS"],
  [426.24,22.45,474.63,36.45,"CAPITAL"],
  [477.8,22.45,568.86,36.45,"IMPROVEMENT"],
  [572.03,22.45,603.09,36.45,"PLAN"],
  [7.26,40.37,41.91,52.37,"Project"],
  [44.62,40.37,64.94,52.37,"No.:"],
  [67.65,40.37,117.04,52.37,"SD202423"],
  [546.07,40.65,575.7,52.65,"Storm"],
  [578.41,40.65,604.78,52.65,"Drain"],
  [367.2,122.03,433.76,134.03,"COMMUNITY"],
  [436.47,122.03,473.54,134.03,"PILLAR:"],
  [476.26,122.03,483.2,134.03,"A"],
  [485.92,122.03,504.52,134.03,"City"],
  [507.23,122.03,529.15,134.03,"That"],
  [531.87,122.03,563.2,134.03,"Works"],
  [367.2,149.93,398.62,161.93,"GOAL:"],
  [401.34,149.93,416.71,161.93,"14:"],
  [419.42,149.93,462.55,161.93,"Develop,"],
  [465.26,149.93,506.78,161.93,"operate,"],
  [509.49,149.93,527.85,161.93,"and"],
  [367.2,161.93,410.42,173.93,"maintain"],
  [413.13,161.93,429.43,173.93,"the"],
  [432.14,161.93,458.08,173.93,"City's"],
  [460.8,161.93,531.23,173.93,"infrastructure."],
  [367.2,187.66,418.07,199.66,"FUNDING:"],
  [420.78,187.66,455.43,199.66,"Project"],
  [458.14,187.66,495.43,199.66,"funding"],
  [498.14,187.66,529.79,199.66,"comes"],
  [532.5,187.66,556.26,199.66,"from"],
  [367.2,199.66,383.5,211.66,"the"],
  [386.21,199.66,401.83,211.66,"CIP"],
  [404.54,199.66,447.96,211.66,"Reserves"],
  [450.67,199.66,454.35,211.66,"-"],
  [457.06,199.66,486.69,211.66,"Storm"],
  [489.4,199.66,516.86,211.66,"Fund."],
  [367.2,225.36,394.26,237.36,"O&M"],
  [396.97,225.36,423.05,237.36,"COST"],
  [425.76,225.36,503.23,237.36,"ASSUMPTIONS:"],
  [505.95,225.36,534.23,237.36,"There"],
  [536.94,225.36,553.78,237.36,"will"],
  [367.2,237.36,379.48,249.36,"be"],
  [382.19,237.36,394.82,249.36,"no"],
  [397.53,237.36,446.55,249.36,"additional"],
  [449.27,237.36,475.66,249.36,"O&M"],
  [478.37,237.36,503.18,249.36,"costs"],
  [505.89,237.36,520.07,249.36,"for"],
  [522.78,237.36,540.55,249.36,"this"],
  [367.2,249.36,404.98,261.36,"project."],
  [266.9,268.25,310.28,280.25,"PROJECT"],
  [312.99,268.25,364.96,280.25,"LOCATION"],
  [270.23,283.87,303.63,295.87,"Arroyo"],
  [306.34,283.87,340.63,295.87,"Mocho"],
  [343.35,283.87,361.71,295.87,"and"],
  [281.36,295.87,318.17,307.87,"Holmes"],
  [320.88,295.87,350.56,307.87,"Street"],
  [34.83,308.07,82.01,324.07,"Project"],
  [85.63,308.07,166.12,324.07,"Description:"],
  [34.83,331.31,54.43,343.31,"This"],
  [57.15,331.31,91.9,343.31,"project"],
  [94.61,331.31,111.45,343.31,"will"],
  [114.16,331.31,149.63,343.31,"include"],
  [152.34,331.31,179.0,343.31,"creek"],
  [181.71,331.31,245.5,343.31,"maintenance"],
  [248.21,331.31,266.57,343.31,"and"],
  [34.83,343.31,99.72,355.31,"management"],
  [102.43,343.31,127.34,355.31,"done"],
  [130.06,343.31,159.12,355.31,"under"],
  [161.84,343.31,178.13,355.31,"the"],
  [180.84,343.31,215.87,355.31,"Stream"],
  [218.58,343.31,283.04,355.31,"Maintenance"],
  [34.83,355.31,79.74,367.31,"Program."],
  [82.45,355.31,100.58,367.31,"The"],
  [103.29,355.31,127.83,367.31,"work"],
  [130.55,355.31,139.61,367.31,"in"],
  [142.32,355.31,153.68,367.31,"FY"],
  [156.39,355.31,196.56,367.31,"2024-25"],
  [199.27,355.31,239.43,367.31,"includes"],
  [242.14,355.31,258.44,367.31,"the"],
  [261.15,355.31,292.83,367.31,"design"],
  [295.54,355.31,305.53,367.31,"of"],
  [34.83,367.31,80.44,379.31,"sediment"],
  [83.15,367.31,123.14,379.31,"removal"],
  [125.85,367.31,144.21,379.31,"and"],
  [146.92,367.31,211.81,379.31,"management"],
  [214.52,367.31,224.97,379.31,"as"],
  [227.68,367.31,247.73,379.31,"well"],
  [250.45,367.31,260.89,379.31,"as"],
  [263.6,367.31,287.41,379.31,"bank"],
  [34.83,379.31,93.76,391.31,"stabilization"],
  [96.47,379.31,123.25,391.31,"along"],
  [125.97,379.31,159.36,391.31,"Arroyo"],
  [162.08,379.31,196.37,391.31,"Mocho"],
  [199.08,379.31,208.85,391.31,"at"],
  [211.56,379.31,248.37,391.31,"Holmes"],
  [251.09,379.31,283.79,391.31,"Street."],
  [286.51,379.31,306.11,391.31,"This"],
  [34.83,391.31,69.59,403.31,"project"],
  [72.3,391.31,79.75,403.31,"is"],
  [82.46,391.31,132.14,403.31,"scheduled"],
  [134.85,391.31,145.2,403.31,"to"],
  [147.91,391.31,160.19,403.31,"be"],
  [162.9,391.31,215.22,403.31,"completed"],
  [217.93,391.31,226.99,403.31,"in"],
  [229.7,391.31,241.06,403.31,"FY"],
  [243.77,391.31,286.97,403.31,"2024-25."],
  [34.83,403.31,97.55,415.31,"Construction"],
  [100.26,403.31,124.81,415.31,"work"],
  [127.52,403.31,141.69,415.31,"for"],
  [144.4,403.31,181.21,415.31,"Holmes"],
  [183.93,403.31,213.6,415.31,"Street"],
  [216.32,403.31,223.76,415.31,"is"],
  [226.48,403.31,266.17,415.31,"planned"],
  [268.88,403.31,277.94,415.31,"in"],
  [280.65,403.31,292.01,415.31,"FY"],
  [34.83,415.31,75.0,427.31,"2025-26"],
  [77.71,415.31,106.78,427.31,"under"],
  [109.49,415.31,144.25,427.31,"project"],
  [146.96,415.31,199.38,427.31,"SD202523."],
  [34.78,511.91,81.96,527.9,"Project"],
  [85.58,511.91,169.97,527.9,"Justification:"],
  [34.83,542.64,57.82,554.64,"Each"],
  [60.53,542.64,84.86,554.64,"year,"],
  [87.57,542.64,103.87,554.64,"the"],
  [106.58,542.64,141.6,554.64,"Stream"],
  [144.32,542.64,208.78,554.64,"Maintenance"],
  [211.49,542.64,253.37,554.64,"Program"],
  [256.08,542.64,301.27,554.64,"identifies"],
  [303.98,542.64,320.27,554.64,"the"],
  [322.99,542.64,358.68,554.64,"highest"],
  [361.39,542.64,378.48,554.64,"risk"],
  [381.19,542.64,407.54,554.64,"areas"],
  [410.25,542.64,441.26,554.64,"where"],
  [443.97,542.64,478.17,554.64,"stream"],
  [480.89,542.64,544.67,554.64,"maintenance"],
  [547.38,542.64,554.83,554.64,"is"],
  [34.83,554.64,79.84,566.64,"required."],
  [82.55,554.64,147.01,566.64,"Maintenance"],
  [149.73,554.64,157.17,566.64,"is"],
  [159.89,554.64,211.57,566.64,"conducted"],
  [214.28,554.64,226.02,566.64,"by"],
  [228.73,554.64,247.34,566.64,"City"],
  [250.05,554.64,278.55,566.64,"crews"],
  [281.26,554.64,290.32,566.64,"in"],
  [293.03,554.64,319.61,566.64,"some"],
  [322.32,554.64,351.7,566.64,"areas."],
  [354.41,554.64,374.01,566.64,"This"],
  [376.72,554.64,411.48,566.64,"project"],
  [414.19,554.64,445.86,566.64,"covers"],
  [448.57,554.64,474.91,566.64,"areas"],
  [477.63,554.64,508.64,566.64,"where"],
  [511.35,554.64,517.1,566.64,"a"],
  [519.81,554.64,571.07,566.64,"contractor"],
  [573.79,554.64,581.23,566.64,"is"],
  [34.83,566.64,76.81,578.64,"required"],
  [79.52,566.64,89.87,578.64,"to"],
  [92.58,566.64,105.22,578.64,"do"],
  [107.93,566.64,124.23,578.64,"the"],
  [126.94,566.64,154.51,578.64,"work."],
  [157.23,566.64,175.35,578.64,"The"],
  [178.06,566.64,218.15,578.64,"purpose"],
  [220.86,566.64,230.85,578.64,"of"],
  [233.57,566.64,251.34,578.64,"this"],
  [254.05,566.64,288.8,578.64,"project"],
  [291.52,566.64,298.96,578.64,"is"],
  [301.68,566.64,312.02,578.64,"to"],
  [314.74,566.64,366.72,578.64,"streamline"],
  [369.43,566.64,394.81,578.64,"flood"],
  [397.52,566.64,432.52,578.64,"control"],
  [435.23,566.64,499.01,578.64,"maintenance"],
  [501.73,566.64,532.44,578.64,"within"],
  [535.15,566.64,551.45,578.64,"the"],
  [554.16,566.64,575.8,578.64,"City."],
  [114.84,628.61,135.52,638.61,"Fund"],
  [166.57,628.61,209.81,638.61,"FY2024-25"],
  [216.65,628.61,259.89,638.61,"FY2025-26"],
  [268.26,628.61,311.5,638.61,"FY2026-27"],
  [319.88,628.61,363.12,638.61,"FY2027-28"],
  [371.49,628.61,414.74,638.61,"FY2028-29"],
  [424.67,628.61,467.91,638.61,"FY2029-30"],
  [479.42,628.61,522.66,638.61,"FY2030-45"],
  [545.19,628.61,566.37,638.61,"Total"],
  [36.26,645.79,79.64,657.79,"PROJECT"],
  [96.79,645.86,109.8,655.86,"CIP"],
  [112.06,645.86,148.22,655.86,"Reserves"],
  [150.48,645.86,153.54,655.86,"-"],
  [169.2,652.61,207.16,662.61,"$325,000"],
  [233.2,652.61,243.33,662.61,"$0"],
  [284.81,652.61,294.95,662.61,"$0"],
  [336.43,652.61,346.56,662.61,"$0"],
  [388.04,652.61,398.18,662.61,"$0"],
  [441.23,652.61,451.36,662.61,"$0"],
  [495.97,652.61,506.11,662.61,"$0"],
  [536.77,652.61,574.81,662.61,"$325,000"],
  [34.18,657.79,81.74,669.79,"FUNDING"],
  [112.83,659.36,137.52,669.36,"Storm"],
  [111.7,676.61,138.64,686.61,"TOTAL"],
  [169.17,676.61,207.21,686.61,"$325,000"],
  [233.2,676.61,243.33,686.61,"$0"],
  [284.81,676.61,294.95,686.61,"$0"],
  [336.43,676.61,346.56,686.61,"$0"],
  [388.04,676.61,398.18,686.61,"$0"],
  [441.23,676.61,451.36,686.61,"$0"],
  [495.97,676.61,506.11,686.61,"$0"],
  [536.77,676.61,574.81,686.61,"$325,000"],
  [192.28,754.56,204.02,766.56,"FY"],
  [206.73,754.56,259.06,766.56,"2025-2030"],
  [261.78,754.56,303.27,766.56,"CAPITAL"],
  [305.99,754.56,384.07,766.56,"IMPROVEMENT"],
  [386.78,754.56,413.42,766.56,"PLAN"],
  [568.67,754.56,580.84,766.56,"79"]
 ]
}
