{
 "doc_id": "livermore-acfr-fy2025",
 "height": 792.0,
 "page": 176,
 "schema_version": 1,
 "width": 612.0,
 "words": [
  [478.75,52.23,500.48,66.27,"City"],
  [503.59,52.23,515.27,66.27,"of"],
  [518.46,52.23,576.16,66.27,"Livermore"],
  [418.51,68.64,457.66,79.68,"Property"],
  [460.1,68.64,475.58,79.68,"Tax"],
  [477.96,68.64,505.33,79.68,"Levies"],
  [507.82,68.64,524.7,79.68,"and"],
  [527.14,68.64,576.09,79.68,"Collections"],
  [485.62,82.1,503.59,93.14,"Last"],
  [506.01,82.1,522.71,93.14,"Ten"],
  [525.18,82.1,549.6,93.14,"Fiscal"],
  [551.94,82.1,576.18,93.14,"Years"],
  [246.44,125.36,280.57,134.73,"Property"],
  [282.65,125.36,296.38,134.73,"Tax"],
  [298.41,125.36,322.22,134.73,"Levies"],
  [324.19,125.36,339.05,134.73,"and"],
  [341.15,125.36,383.77,134.73,"Collections"],
  [275.73,137.6,291.27,146.97,"Last"],
  [293.32,137.6,307.79,146.97,"Ten"],
  [309.89,137.6,331.03,146.97,"Fiscal"],
  [333.01,137.6,354.38,146.97,"Years"],
  [71.67,154.1,92.82,163.47,"Fiscal"],
  [248.29,154.1,284.48,163.47,"Collected"],
  [286.55,154.1,311.46,163.47,"within"],
  [313.55,154.1,326.67,163.47,"the"],
  [73.52,166.32,91.19,175.69,"Year"],
  [137.45,166.32,159.63,175.69,"Taxes"],
  [161.59,166.32,186.71,175.69,"Levied"],
  [244.6,166.32,265.75,175.69,"Fiscal"],
  [267.73,166.32,285.4,175.69,"Year"],
  [287.38,166.32,295.46,175.69,"of"],
  [297.59,166.32,310.71,175.69,"the"],
  [312.73,166.32,330.29,175.69,"Levy"],
  [388.19,166.32,431.75,175.69,"Delinquent"],
  [469.13,166.32,512.69,175.69,"Delinquent"],
  [514.74,166.32,528.46,175.69,"Tax"],
  [70.03,178.57,94.52,187.94,"Ended"],
  [148.92,178.57,160.43,187.94,"for"],
  [162.41,178.57,175.53,187.94,"the"],
  [305.64,178.57,349.47,187.94,"Percentage"],
  [380.82,178.57,414.95,187.94,"Property"],
  [417.03,178.57,439.21,187.94,"Taxes"],
  [476.5,178.57,519.12,187.94,"Collections"],
  [66.35,190.78,84.37,200.15,"June"],
  [86.38,190.78,98.24,200.15,"30,"],
  [135.61,190.78,156.76,200.15,"Fiscal"],
  [158.73,190.78,176.41,200.15,"Year"],
  [178.38,190.78,188.89,200.15,"(a)"],
  [237.61,190.78,269.51,200.15,"Amount"],
  [313.63,190.78,321.71,200.15,"of"],
  [323.84,190.78,341.4,200.15,"Levy"],
  [375.29,190.78,386.8,200.15,"for"],
  [388.78,190.78,401.9,200.15,"the"],
  [403.92,190.78,425.07,200.15,"Fiscal"],
  [427.04,190.78,444.72,200.15,"Year"],
  [475.27,190.78,509.48,200.15,"(Refund)"],
  [511.45,190.78,522.36,200.15,"(b)"],
  [72.9,215.25,91.81,224.63,"2016"],
  [129.65,215.25,134.42,224.63,"$"],
  [151.79,215.25,194.04,224.63,"27,839,513"],
  [226.55,215.25,231.33,224.63,"$"],
  [239.68,215.25,281.93,224.63,"27,718,828"],
  [322.64,215.25,350.67,224.63,"99.57%"],
  [372.63,215.25,377.4,224.63,"$"],
  [416.27,215.25,446.85,224.63,"120,685"],
  [471.58,215.25,476.36,224.63,"$"],
  [494.93,215.25,525.51,224.63,"320,482"],
  [72.9,227.48,91.81,236.85,"2017"],
  [151.79,227.48,194.04,236.85,"29,014,829"],
  [239.68,227.48,281.93,236.85,"28,341,709"],
  [322.64,227.48,350.67,236.85,"97.68%"],
  [416.27,227.48,446.85,236.85,"673,120"],
  [494.93,227.48,525.51,236.85,"321,785"],
  [72.9,239.72,91.81,249.09,"2018"],
  [151.79,239.72,194.04,249.09,"31,087,296"],
  [239.68,239.72,281.93,249.09,"30,559,069"],
  [322.64,239.72,350.67,249.09,"98.30%"],
  [416.27,239.72,446.85,249.09,"528,227"],
  [494.93,239.72,525.51,249.09,"338,288"],
  [72.9,251.94,91.81,261.31,"2019"],
  [151.79,251.94,194.04,261.31,"33,273,066"],
  [239.68,251.94,281.93,261.31,"32,570,581"],
  [322.64,251.94,350.67,261.31,"97.89%"],
  [416.27,251.94,446.85,261.31,"702,485"],
  [494.93,251.94,525.51,261.31,"533,453"],
  [72.9,264.16,91.81,273.53,"2020"],
  [151.79,264.16,194.04,273.53,"35,368,204"],
  [239.68,264.16,281.93,273.53,"34,740,288"],
  [322.64,264.16,350.67,273.53,"98.22%"],
  [416.27,264.16,446.85,273.53,"627,916"],
  [494.93,264.16,525.51,273.53,"341,676"],
  [72.9,276.41,91.81,285.78,"2021"],
  [151.79,276.41,194.04,285.78,"36,930,452"],
  [239.68,276.41,281.93,285.78,"36,077,734"],
  [322.64,276.41,350.67,285.78,"97.69%"],
  [416.27,276.41,446.85,285.78,"852,718"],
  [494.93,276.41,525.51,285.78,"451,056"],
  [72.9,288.63,91.81,298.0,"2022"],
  [151.79,288.63,194.04,298.0,"38,114,809"],
  [239.68,288.63,281.93,298.0,"37,598,776"],
  [322.64,288.63,350.67,298.0,"98.65%"],
  [416.27,288.63,446.85,298.0,"516,033"],
  [494.93,288.63,525.51,298.0,"414,496"],
  [72.9,300.86,91.81,310.23,"2023"],
  [151.79,300.86,194.04,310.23,"41,369,080"],
  [239.68,300.86,281.93,310.23,"40,870,045"],
  [322.64,300.86,350.67,310.23,"98.79%"],
  [416.27,300.86,446.85,310.23,"499,035"],
  [494.93,300.86,525.51,310.23,"371,527"],
  [72.9,313.1,91.81,322.47,"2024"],
  [151.79,313.1,194.04,322.47,"43,552,728"],
  [239.68,313.1,281.93,322.47,"43,327,514"],
  [322.64,313.1,350.67,322.47,"99.48%"],
  [416.27,313.1,446.85,322.47,"225,214"],
  [494.93,313.1,525.51,322.47,"412,414"],
  [72.9,325.32,91.81,334.69,"2025"],
  [151.79,325.32,194.04,334.69,"46,069,054"],
  [239.68,325.32,281.93,334.69,"45,378,219"],
  [322.64,325.32,350.67,334.69,"98.50%"],
  [416.27,325.32,446.85,334.69,"690,835"],
  [494.93,325.32,525.51,334.69,"502,166"],
  [56.11,349.78,85.29,359.15,"Source:"],
  [89.44,349.78,124.17,359.15,"Alameda"],
  [126.26,349.78,154.23,359.15,"County"],
  [156.31,349.78,179.66,359.15,"Office"],
  [181.68,349.78,189.76,359.15,"of"],
  [191.89,349.78,205.01,359.15,"the"],
  [207.03,349.78,279.11,359.15,"Auditor-Controller"],
  [281.08,349.78,295.95,359.15,"and"],
  [298.04,349.78,312.94,359.15,"City"],
  [315.03,349.78,323.11,359.15,"of"],
  [325.24,349.78,364.56,359.15,"Livermore"],
  [366.57,349.78,396.67,359.15,"Finance"],
  [398.69,349.78,429.73,359.15,"Division"],
  [56.11,374.24,66.33,383.61,"(a)"],
  [68.39,374.24,89.88,383.61,"Taxes"],
  [91.93,374.24,116.71,383.61,"Levied"],
  [118.74,374.24,146.56,383.61,"include"],
  [148.62,374.24,181.11,383.61,"secured,"],
  [183.03,374.24,225.34,383.61,"unsecured,"],
  [227.27,374.24,241.63,383.61,"and"],
  [243.65,374.24,282.13,383.61,"estimated"],
  [284.16,374.24,311.38,383.61,"unitary"],
  [313.44,374.24,327.48,383.61,"tax."],
  [74.54,386.48,87.62,395.85,"Tax"],
  [89.67,386.48,111.55,395.85,"levies"],
  [113.59,386.48,126.04,395.85,"are"],
  [128.1,386.48,140.87,395.85,"net"],
  [142.83,386.48,150.61,395.85,"of"],
  [152.64,386.48,190.26,395.85,"payments"],
  [192.3,386.48,203.35,395.85,"for"],
  [74.54,398.7,77.42,408.07,"-"],
  [79.46,398.7,124.01,408.07,"Educational"],
  [126.12,398.7,159.47,408.07,"Revenue"],
  [161.54,398.7,216.41,408.07,"Augmentation"],
  [218.42,398.7,239.85,408.07,"Fund."],
  [74.54,410.92,77.42,420.29,"-"],
  [79.46,410.92,140.35,420.29,"Redevelopment"],
  [142.3,410.92,175.44,420.29,"agencies"],
  [177.51,410.92,188.58,420.29,"for"],
  [190.62,410.92,203.3,420.29,"the"],
  [205.36,410.92,224.72,420.29,"fiscal"],
  [226.83,410.92,247.3,420.29,"years"],
  [249.35,410.92,280.54,420.29,"2005-06"],
  [282.52,410.92,313.06,420.29,"through"],
  [315.08,410.92,346.27,420.29,"2011-12"],
  [74.54,423.16,77.42,432.53,"-"],
  [79.46,423.16,140.35,432.53,"Redevelopment"],
  [142.3,423.16,175.65,432.53,"Property"],
  [177.72,423.16,190.81,432.53,"Tax"],
  [192.87,423.16,212.41,432.53,"Trust"],
  [214.36,423.16,233.44,432.53,"Fund"],
  [235.46,423.16,264.54,432.53,"(RPTTF)"],
  [266.57,423.16,304.24,432.53,"payments"],
  [306.3,423.16,344.09,432.53,"beginning"],
  [346.19,423.16,364.78,432.53,"from"],
  [366.86,423.16,387.66,432.53,"Fiscal"],
  [389.77,423.16,406.56,432.53,"year"],
  [408.6,423.16,442.1,432.53,"2012-13."],
  [56.11,447.61,66.76,456.98,"(b)"],
  [68.81,447.61,102.79,456.98,"Alameda"],
  [104.82,447.61,132.02,456.98,"County"],
  [134.09,447.61,152.3,456.98,"does"],
  [154.37,447.61,167.36,456.98,"not"],
  [169.32,447.61,198.58,456.98,"provide"],
  [200.64,447.61,242.3,456.98,"delinquent"],
  [244.25,447.61,255.91,456.98,"tax"],
  [257.97,447.61,295.04,456.98,"collection"],
  [297.05,447.61,314.05,456.98,"data"],
  [316.1,447.61,325.28,456.98,"by"],
  [327.36,447.61,342.87,456.98,"levy"],
  [344.94,447.61,364.09,456.98,"year,"],
  [366.03,447.61,374.67,456.98,"so"],
  [376.67,447.61,389.35,456.98,"the"],
  [391.41,447.61,425.0,456.98,"amounts"],
  [427.05,447.61,452.25,456.98,"shown"],
  [454.3,447.61,461.48,456.98,"in"],
  [463.5,447.61,476.18,456.98,"the"],
  [66.34,459.85,108.0,469.22,"delinquent"],
  [109.95,459.85,121.61,469.22,"tax"],
  [123.66,459.85,164.39,469.22,"collections"],
  [166.44,459.85,194.92,469.22,"column"],
  [196.93,459.85,224.75,469.22,"include"],
  [226.82,459.85,273.46,469.22,"delinquency"],
  [275.54,459.85,316.26,469.22,"collections"],
  [318.31,459.85,329.38,469.22,"for"],
  [331.42,459.85,340.33,469.22,"all"],
  [342.45,459.85,361.09,469.22,"prior"],
  [363.13,459.85,383.6,469.22,"years"],
  [385.65,459.85,401.31,469.22,"that"],
  [403.26,459.85,422.69,469.22,"were"],
  [424.75,459.85,458.32,469.22,"remitted"],
  [460.35,459.85,468.39,469.22,"to"],
  [470.39,459.85,483.07,469.22,"the"],
  [66.34,472.07,81.03,481.45,"City"],
  [83.1,472.07,90.29,481.45,"in"],
  [92.3,472.07,110.35,481.45,"each"],
  [112.37,472.07,131.73,481.45,"fiscal"],
  [133.84,472.07,153.0,481.45,"year."],
  [559.42,744.82,576.17,755.86,"143"]
 ]
}
