{
 "doc_id": "livermore-budget-fy2026-2027",
 "height": 792.0,
 "page": 45,
 "schema_version": 1,
 "width": 612.0,
 "words": [
  [215.84,4.68,281.05,28.94,"ABOUT"],
  [286.63,4.68,395.88,28.94,"LIVERMORE"],
  [219.32,34.96,320.65,51.93,"PERFORMANCE"],
  [324.56,34.96,393.68,51.93,"MEASURES"],
  [54.0,73.34,198.8,85.59,"LIVERMORE-PLEASANTON"],
  [201.85,73.34,226.91,85.59,"FIRE"],
  [229.99,73.34,306.29,85.59,"DEPARTMENT"],
  [309.44,73.34,315.54,85.59,"–"],
  [318.64,73.34,404.77,85.59,"PERFORMANCE"],
  [407.82,73.34,470.14,85.59,"MEASURES"],
  [54.0,98.84,72.92,111.09,"The"],
  [76.0,98.84,183.59,111.09,"Livermore-Pleasanton"],
  [186.64,98.84,205.58,111.09,"Fire"],
  [208.63,98.84,266.04,111.09,"Department"],
  [269.09,98.84,304.54,111.09,"(LPFD)"],
  [307.6,98.84,350.37,111.09,"operates"],
  [353.47,98.84,370.58,111.09,"five"],
  [373.63,98.84,388.88,111.09,"fire"],
  [391.97,98.84,429.8,111.09,"stations"],
  [432.9,98.84,441.44,111.09,"in"],
  [444.53,98.84,496.35,111.09,"Livermore."],
  [499.43,98.84,518.35,111.09,"The"],
  [54.0,111.44,91.28,123.69,"mission"],
  [94.33,111.44,103.51,123.69,"of"],
  [106.56,111.44,134.59,123.69,"LPFD"],
  [137.65,111.44,145.6,123.69,"is"],
  [148.67,111.44,157.83,123.69,"to"],
  [160.88,111.44,196.92,123.69,"provide"],
  [200.0,111.44,255.63,123.69,"exceptional"],
  [258.68,111.44,287.4,123.69,"public"],
  [290.45,111.44,319.78,123.69,"safety"],
  [322.83,111.44,363.14,123.69,"services"],
  [366.22,111.44,384.55,123.69,"that"],
  [387.61,111.44,429.76,123.69,"enhance"],
  [432.83,111.44,448.09,123.69,"the"],
  [451.17,111.44,513.79,123.69,"quality-of-life"],
  [516.84,111.44,525.42,123.69,"in"],
  [528.52,111.44,543.73,123.69,"the"],
  [54.0,124.12,107.1,136.37,"community"],
  [110.18,124.12,121.78,136.37,"by"],
  [124.83,124.12,173.13,136.37,"protecting"],
  [176.19,124.12,193.34,136.37,"life,"],
  [196.39,124.12,239.72,136.37,"property,"],
  [242.77,124.12,261.08,136.37,"and"],
  [264.16,124.12,279.42,136.37,"the"],
  [282.5,124.12,346.01,136.37,"environment."],
  [349.13,124.12,374.76,136.37,"Duty,"],
  [377.81,124.12,419.99,136.37,"Integrity,"],
  [423.04,124.12,503.74,136.37,"Professionalism,"],
  [506.79,124.12,548.96,136.37,"Courage"],
  [54.0,136.78,72.31,149.03,"and"],
  [75.4,136.78,105.33,149.03,"Honor"],
  [108.38,136.78,124.25,149.03,"are"],
  [127.34,136.78,142.6,149.03,"the"],
  [145.68,136.78,181.71,149.03,"LPFD’s"],
  [184.78,136.78,206.17,149.03,"core"],
  [209.22,136.78,244.02,149.03,"values."],
  [247.07,136.78,288.57,149.03,"Demand"],
  [291.65,136.78,304.46,149.03,"for"],
  [307.54,136.78,361.91,149.03,"emergency"],
  [364.96,136.78,410.16,149.03,"response"],
  [413.21,136.78,460.29,149.03,"continues"],
  [463.33,136.78,472.49,149.03,"to"],
  [475.54,136.78,502.42,149.03,"grow,"],
  [505.48,136.78,548.88,149.03,"including"],
  [54.0,149.44,99.23,161.69,"response"],
  [102.31,149.44,111.47,161.69,"to"],
  [114.52,149.44,160.93,161.69,"California"],
  [164.01,149.44,206.75,161.69,"wildfires."],
  [366.52,179.47,403.29,190.64,"2023-24"],
  [435.82,179.47,472.59,190.64,"2024-25"],
  [505.06,179.47,541.85,190.64,"2025-26"],
  [149.84,185.17,211.02,196.34,"Performance"],
  [213.77,185.17,254.39,196.34,"Measure"],
  [369.58,190.93,400.18,202.1,"Actual"],
  [438.88,190.93,469.48,202.1,"Actual"],
  [508.12,190.93,538.7,202.1,"Target"],
  [79.5,209.41,102.33,220.58,"FIRE"],
  [105.06,209.41,171.23,220.58,"OPERATIONS"],
  [79.38,225.79,114.97,236.96,"Number"],
  [117.78,225.79,126.13,236.96,"of"],
  [128.88,225.79,178.29,236.96,"emergency"],
  [181.07,225.79,227.24,236.96,"responses"],
  [389.08,225.79,414.15,236.96,"9,466"],
  [458.38,225.79,483.46,236.96,"9,750"],
  [522.04,225.79,552.68,236.96,"10,043"],
  [79.38,242.17,114.97,253.34,"Number"],
  [117.8,242.17,126.16,253.34,"of"],
  [128.9,242.17,178.93,253.34,"Responses"],
  [181.72,242.17,190.03,253.34,"to"],
  [192.82,242.17,210.07,253.34,"Fire"],
  [212.86,242.17,252.83,253.34,"Incidents"],
  [397.42,242.17,414.15,253.34,"277"],
  [466.72,242.17,483.45,253.34,"285"],
  [535.98,242.17,552.71,253.34,"294"],
  [79.38,260.05,116.66,271.22,"Average"],
  [119.45,260.05,170.02,271.22,"Emergency"],
  [172.81,260.05,217.84,271.22,"Response"],
  [220.62,260.05,242.89,271.22,"Time"],
  [394.66,265.81,414.16,276.98,"4:51"],
  [463.96,265.81,483.46,276.98,"5:15"],
  [533.22,265.81,552.72,276.98,"5:40"],
  [62.16,271.51,79.41,282.68,"Fire"],
  [82.2,271.51,122.75,282.68,"Standard"],
  [125.54,271.51,131.39,282.68,"="],
  [134.17,271.51,153.64,282.68,"6:00"],
  [156.43,271.51,191.45,282.68,"minutes"],
  [79.38,290.83,116.66,302.0,"Average"],
  [119.45,290.83,170.02,302.0,"Emergency"],
  [172.81,290.83,217.84,302.0,"Response"],
  [220.62,290.83,242.89,302.0,"Time"],
  [394.66,296.59,414.16,307.76,"5:38"],
  [463.96,296.59,483.46,307.76,"5:20"],
  [533.22,296.59,552.72,307.76,"5:30"],
  [62.16,302.35,83.87,313.52,"EMS"],
  [86.61,302.35,127.24,313.52,"Standard"],
  [130.03,302.35,135.88,313.52,"="],
  [138.66,302.35,158.08,313.52,"6:00"],
  [160.87,302.35,195.87,313.52,"minutes"],
  [79.5,320.17,102.33,331.34,"FIRE"],
  [105.06,320.17,170.08,331.34,"PREVENTION"],
  [79.38,336.61,135.59,347.78,"Construction"],
  [138.29,336.61,188.9,347.78,"Inspections"],
  [191.68,336.61,240.09,347.78,"Conducted"],
  [397.42,336.61,414.15,347.78,"735"],
  [466.72,336.61,483.45,347.78,"750"],
  [535.98,336.61,552.71,347.78,"775"],
  [79.38,352.99,110.57,364.16,"Annual"],
  [113.36,352.99,130.55,364.16,"Fire"],
  [133.34,352.99,178.9,364.16,"Inspection"],
  [181.68,352.99,220.06,364.16,"Program"],
  [397.42,352.99,414.15,364.16,"559"],
  [466.72,352.99,483.45,364.16,"560"],
  [535.98,352.99,552.71,364.16,"560"],
  [242.02,741.98,293.82,761.99,"BUDGET"],
  [297.74,741.98,313.14,761.99,"FY"],
  [317.06,741.98,369.98,761.99,"2025-27"],
  [485.11,741.98,520.39,761.99,"Page"],
  [524.32,741.98,540.0,761.99,"41"]
 ]
}
