{
 "doc_id": "livermore-cip-fy2026-2030",
 "height": 792.0,
 "page": 267,
 "schema_version": 1,
 "width": 612.0,
 "words": [
  [426.14,22.17,474.54,36.17,"CAPITAL"],
  [477.7,22.17,568.76,36.17,"IMPROVEMENT"],
  [571.93,22.17,602.99,36.17,"PLAN"],
  [534.77,40.65,559.2,52.65,"Fund"],
  [561.91,40.65,604.73,52.65,"Balances"],
  [201.91,244.71,408.4,330.71,"FUND"],
  [119.21,347.46,491.04,433.46,"BALANCES"],
  [192.28,754.56,204.02,766.56,"FY"],
  [206.73,754.56,259.06,766.56,"2025-2030"],
  [261.78,754.56,303.27,766.56,"CAPITAL"],
  [305.99,754.56,384.07,766.56,"IMPROVEMENT"],
  [386.78,754.56,413.42,766.56,"PLAN"],
  [565.62,754.56,583.87,766.56,"263"]
 ]
}
