{
 "doc_id": "livermore-acfr-fy2025",
 "height": 792.0,
 "page": 1,
 "schema_version": 1,
 "width": 612.0,
 "words": [
  [35.29,63.79,102.55,101.2,"CITY"],
  [120.72,63.79,158.03,101.2,"OF"],
  [176.52,63.79,359.37,101.2,"LIVERMORE"],
  [377.77,63.79,569.29,101.2,"CALIFORNIA"],
  [68.45,118.33,221.97,177.26,"ANNUAL"],
  [232.05,118.33,545.42,177.26,"COMPREHENSIVE"],
  [134.69,171.13,326.89,230.06,"FINANCIAL"],
  [336.96,171.13,479.12,230.06,"REPORT"],
  [163.25,249.88,218.52,277.7,"FISCAL"],
  [223.0,249.88,266.32,277.7,"YEAR"],
  [270.76,249.88,328.62,277.7,"ENDED"],
  [333.16,249.88,375.82,277.7,"JUNE"],
  [380.09,249.88,405.66,277.7,"30,"],
  [409.98,249.88,450.74,277.7,"2025"]
 ]
}
