{
 "doc_id": "livermore-acfr-fy2025",
 "height": 792.0,
 "page": 30,
 "schema_version": 1,
 "width": 612.0,
 "words": [
  [72.02,74.16,80.6,85.2,"In"],
  [83.04,74.16,133.11,85.2,"connection"],
  [135.47,74.16,155.4,85.2,"with"],
  [157.79,74.16,173.28,85.2,"our"],
  [175.78,74.16,198.71,85.2,"audit"],
  [201.2,74.16,210.47,85.2,"of"],
  [212.86,74.16,227.85,85.2,"the"],
  [230.35,74.16,268.11,85.2,"financial"],
  [270.45,74.16,323.58,85.2,"statements,"],
  [326.12,74.16,341.61,85.2,"our"],
  [343.97,74.16,403.82,85.2,"responsibility"],
  [406.35,74.16,413.09,85.2,"is"],
  [415.59,74.16,425.04,85.2,"to"],
  [427.59,74.16,447.91,85.2,"read"],
  [450.41,74.16,465.4,85.2,"the"],
  [467.81,74.16,492.39,85.2,"other"],
  [72.02,87.62,125.3,98.66,"information"],
  [127.76,87.62,144.65,98.66,"and"],
  [146.99,87.62,185.15,98.66,"consider"],
  [187.54,87.62,225.56,98.66,"whether"],
  [227.94,87.62,233.23,98.66,"a"],
  [235.65,87.62,273.08,98.66,"material"],
  [275.58,87.62,335.88,98.66,"inconsistency"],
  [338.31,87.62,363.37,98.66,"exists"],
  [365.91,87.62,405.41,98.66,"between"],
  [407.87,87.62,422.74,98.66,"the"],
  [425.16,87.62,449.88,98.66,"other"],
  [452.37,87.62,505.44,98.66,"information"],
  [507.91,87.62,524.79,98.66,"and"],
  [72.02,101.06,87.02,112.1,"the"],
  [89.51,101.06,112.12,112.1,"basic"],
  [114.62,101.06,152.34,112.1,"financial"],
  [154.68,101.06,207.82,112.1,"statements,"],
  [210.36,101.06,220.08,112.1,"or"],
  [222.44,101.06,237.44,112.1,"the"],
  [239.85,101.06,264.44,112.1,"other"],
  [266.96,101.06,319.99,112.1,"information"],
  [322.46,101.06,367.33,112.1,"otherwise"],
  [369.87,101.06,405.51,112.1,"appears"],
  [408.0,101.06,417.45,112.1,"to"],
  [420.0,101.06,431.3,112.1,"be"],
  [433.68,101.06,478.68,112.1,"materially"],
  [481.07,101.06,527.7,112.1,"misstated."],
  [530.16,101.06,539.07,112.1,"If,"],
  [72.02,114.5,98.69,125.54,"based"],
  [101.18,114.5,112.85,125.54,"on"],
  [115.21,114.5,130.2,125.54,"the"],
  [132.61,114.5,155.14,125.54,"work"],
  [157.67,114.5,208.43,125.54,"performed,"],
  [210.93,114.5,224.34,125.54,"we"],
  [226.74,114.5,267.18,125.54,"conclude"],
  [269.71,114.5,288.04,125.54,"that"],
  [290.57,114.5,301.66,125.54,"an"],
  [304.11,114.5,358.88,125.54,"uncorrected"],
  [361.24,114.5,398.66,125.54,"material"],
  [401.05,114.5,462.82,125.54,"misstatement"],
  [465.22,114.5,474.47,125.54,"of"],
  [476.96,114.5,491.95,125.54,"the"],
  [494.35,114.5,518.98,125.54,"other"],
  [72.02,127.82,125.3,138.86,"information"],
  [127.67,127.82,155.5,138.86,"exists,"],
  [157.99,127.82,171.32,138.86,"we"],
  [173.85,127.82,188.34,138.86,"are"],
  [190.87,127.82,229.31,138.86,"required"],
  [231.76,127.82,241.2,138.86,"to"],
  [243.75,127.82,281.55,138.86,"describe"],
  [284.08,127.82,290.32,138.86,"it"],
  [292.81,127.82,301.15,138.86,"in"],
  [303.52,127.82,318.89,138.86,"our"],
  [321.38,127.82,352.58,138.86,"report."],
  [72.02,155.3,98.62,166.34,"Other"],
  [100.94,155.3,146.13,166.34,"Reporting"],
  [148.22,155.3,189.9,166.34,"Required"],
  [191.9,155.3,203.01,166.34,"by"],
  [205.46,155.3,262.33,166.34,"Government"],
  [264.53,155.3,303.59,166.34,"Auditing"],
  [305.93,155.3,352.02,166.34,"Standards"],
  [72.02,182.18,80.58,193.22,"In"],
  [82.82,182.18,134.04,193.22,"accordance"],
  [136.22,182.18,156.15,193.22,"with"],
  [158.42,182.18,213.83,193.22,"Government"],
  [216.17,182.18,253.88,193.22,"Auditing"],
  [256.01,182.18,303.89,193.22,"Standards,"],
  [305.93,182.18,319.35,193.22,"we"],
  [321.65,182.18,343.11,193.22,"have"],
  [345.43,182.18,363.39,193.22,"also"],
  [365.71,182.18,393.93,193.22,"issued"],
  [396.07,182.18,411.56,193.22,"our"],
  [413.71,182.18,442.14,193.22,"report"],
  [444.43,182.18,470.36,193.22,"dated"],
  [472.63,182.18,518.92,193.22,"December"],
  [521.33,182.18,535.35,193.22,"31,"],
  [72.02,195.62,97.22,206.66,"2025,"],
  [99.62,195.62,111.29,206.66,"on"],
  [113.66,195.62,129.14,206.66,"our"],
  [131.64,195.62,192.87,206.66,"consideration"],
  [195.21,195.62,204.47,206.66,"of"],
  [206.87,195.62,221.86,206.66,"the"],
  [224.35,195.62,248.5,206.66,"City’s"],
  [250.99,195.62,285.85,206.66,"internal"],
  [288.34,195.62,320.39,206.66,"control"],
  [322.78,195.62,342.92,206.66,"over"],
  [345.44,195.62,383.15,206.66,"financial"],
  [385.62,195.62,427.55,206.66,"reporting"],
  [429.9,195.62,446.73,206.66,"and"],
  [449.19,195.62,460.89,206.66,"on"],
  [463.35,195.62,478.86,206.66,"our"],
  [481.22,195.62,502.68,206.66,"tests"],
  [505.11,195.62,514.35,206.66,"of"],
  [516.85,195.62,527.4,206.66,"its"],
  [72.02,208.94,123.35,219.98,"compliance"],
  [125.78,208.94,145.71,219.98,"with"],
  [148.2,208.94,179.45,219.98,"certain"],
  [181.95,208.94,227.52,219.98,"provisions"],
  [229.93,208.94,239.17,219.98,"of"],
  [241.66,208.94,264.33,219.98,"laws,"],
  [266.87,208.94,319.65,219.98,"regulations,"],
  [322.15,208.94,366.66,219.98,"contracts,"],
  [369.03,208.94,385.91,219.98,"and"],
  [388.35,208.94,412.12,219.98,"grant"],
  [414.65,208.94,467.8,219.98,"agreements"],
  [470.31,208.94,487.15,219.98,"and"],
  [489.51,208.94,514.23,219.98,"other"],
  [72.02,222.38,109.94,233.42,"matters."],
  [112.43,222.38,128.98,233.42,"The"],
  [131.51,222.38,168.2,233.42,"purpose"],
  [170.62,222.38,179.86,233.42,"of"],
  [182.36,222.38,200.72,233.42,"that"],
  [203.23,222.38,231.66,233.42,"report"],
  [234.18,222.38,241.04,233.42,"is"],
  [243.4,222.38,269.04,233.42,"solely"],
  [271.47,222.38,280.99,233.42,"to"],
  [283.45,222.38,321.25,233.42,"describe"],
  [323.78,222.38,338.77,233.42,"the"],
  [341.27,222.38,367.19,233.42,"scope"],
  [369.72,222.38,378.85,233.42,"of"],
  [381.34,222.38,396.84,233.42,"our"],
  [399.21,222.38,429.85,233.42,"testing"],
  [432.2,222.38,441.44,233.42,"of"],
  [443.94,222.38,478.9,233.42,"internal"],
  [481.25,222.38,513.44,233.42,"control"],
  [515.79,222.38,535.96,233.42,"over"],
  [72.02,235.82,109.74,246.86,"financial"],
  [112.2,235.82,154.13,246.86,"reporting"],
  [156.58,235.82,173.46,246.86,"and"],
  [175.9,235.82,227.24,246.86,"compliance"],
  [229.77,235.82,246.61,246.86,"and"],
  [248.97,235.82,263.97,246.86,"the"],
  [266.46,235.82,296.38,246.86,"results"],
  [298.77,235.82,308.02,246.86,"of"],
  [310.38,235.82,328.86,246.86,"that"],
  [331.38,235.82,364.72,246.86,"testing,"],
  [367.21,235.82,384.09,246.86,"and"],
  [386.53,235.82,401.77,246.86,"not"],
  [404.18,235.82,413.7,246.86,"to"],
  [416.16,235.82,450.46,246.86,"provide"],
  [452.86,235.82,463.94,246.86,"an"],
  [466.33,235.82,500.43,246.86,"opinion"],
  [502.79,235.82,514.46,246.86,"on"],
  [516.92,235.82,531.92,246.86,"the"],
  [72.02,249.26,130.9,260.3,"effectiveness"],
  [133.33,249.26,142.57,260.3,"of"],
  [145.06,249.26,159.94,260.3,"the"],
  [162.46,249.26,186.58,260.3,"City’s"],
  [189.07,249.26,223.92,260.3,"internal"],
  [226.42,249.26,258.58,260.3,"control"],
  [260.93,249.26,281.1,260.3,"over"],
  [283.48,249.26,321.1,260.3,"financial"],
  [323.59,249.26,365.51,260.3,"reporting"],
  [367.96,249.26,377.71,260.3,"or"],
  [380.1,249.26,391.76,260.3,"on"],
  [394.23,249.26,448.26,260.3,"compliance."],
  [450.78,249.26,470.94,260.3,"That"],
  [473.31,249.26,501.76,260.3,"report"],
  [504.28,249.26,511.14,260.3,"is"],
  [513.52,249.26,524.61,260.3,"an"],
  [72.02,262.73,106.37,273.77,"integral"],
  [108.82,262.73,127.46,273.77,"part"],
  [129.84,262.73,139.08,273.77,"of"],
  [141.58,262.73,152.66,273.77,"an"],
  [155.16,262.73,178.2,273.77,"audit"],
  [180.57,262.73,228.7,273.77,"performed"],
  [231.2,262.73,239.53,273.77,"in"],
  [241.98,262.73,293.11,273.77,"accordance"],
  [295.64,262.73,315.36,273.77,"with"],
  [317.93,262.73,373.46,273.77,"Government"],
  [375.99,262.73,413.7,273.77,"Auditing"],
  [416.06,262.73,461.03,273.77,"Standards"],
  [463.63,262.73,471.97,273.77,"in"],
  [474.41,262.73,526.06,273.77,"considering"],
  [72.02,276.17,96.25,287.21,"City’s"],
  [98.54,276.17,133.49,287.21,"internal"],
  [135.86,276.17,167.91,287.21,"control"],
  [170.06,276.17,190.21,287.21,"over"],
  [192.5,276.17,230.21,287.21,"financial"],
  [232.67,276.17,274.6,287.21,"reporting"],
  [277.01,276.17,293.85,287.21,"and"],
  [296.33,276.17,350.32,287.21,"compliance."],
  [72.02,337.73,101.11,348.77,"Menlo"],
  [103.55,337.73,126.12,348.77,"Park,"],
  [128.62,337.73,171.38,348.77,"California"],
  [72.02,351.17,118.31,362.21,"December"],
  [120.83,351.17,134.74,362.21,"31,"],
  [137.14,351.17,159.41,362.21,"2025"],
  [534.58,744.82,540.18,755.86,"4"]
 ]
}
