{
 "doc_id": "livermore-cip-fy2026-2030",
 "height": 792.0,
 "page": 163,
 "schema_version": 1,
 "width": 612.0,
 "words": [
  [426.14,22.17,474.54,36.17,"CAPITAL"],
  [477.7,22.17,568.76,36.17,"IMPROVEMENT"],
  [571.93,22.17,602.99,36.17,"PLAN"],
  [7.26,25.1,62.19,40.1,"STANLEY"],
  [65.57,25.1,217.47,40.1,"BOULEVARD/MURRIETA"],
  [220.86,25.1,273.12,40.1,"AVENUE"],
  [276.51,25.1,367.35,40.1,"INTERSECTION"],
  [7.26,39.68,111.94,54.68,"IMPROVEMENTS"],
  [460.5,40.65,533.27,52.65,"Transportation"],
  [535.98,40.65,603.66,52.65,"Infrastructure"],
  [7.26,54.02,41.89,66.01,"Project"],
  [44.6,54.02,64.9,66.01,"No.:"],
  [67.61,54.02,112.96,66.01,"TI200835"],
  [367.2,120.79,433.76,132.79,"COMMUNITY"],
  [436.47,120.79,473.54,132.79,"PILLAR:"],
  [476.26,120.79,483.2,132.79,"A"],
  [485.92,120.79,506.81,132.79,"Safe"],
  [509.52,120.79,566.24,132.79,"Community"],
  [367.2,132.79,389.12,144.79,"That"],
  [391.83,132.79,427.01,144.79,"Thrives"],
  [367.2,156.84,398.62,168.84,"GOAL:"],
  [401.34,156.84,427.98,168.84,"Work"],
  [430.69,156.84,441.04,168.84,"to"],
  [443.75,156.84,486.97,168.84,"maintain"],
  [489.68,156.84,495.43,168.84,"a"],
  [498.15,156.84,518.22,168.84,"safe"],
  [520.93,156.84,539.29,168.84,"and"],
  [367.2,168.84,407.37,180.84,"efficient"],
  [410.08,168.84,432.74,180.84,"local"],
  [435.46,168.84,506.4,180.84,"transportation"],
  [509.11,168.84,549.95,180.84,"network"],
  [552.66,168.84,571.02,180.84,"and"],
  [367.2,180.84,405.1,192.84,"address"],
  [407.81,180.84,437.34,192.84,"safety"],
  [440.05,180.84,487.01,192.84,"concerns."],
  [367.2,202.58,418.07,214.58,"FUNDING:"],
  [420.78,202.58,455.43,214.58,"Project"],
  [458.14,202.58,495.43,214.58,"funding"],
  [498.14,202.58,529.79,214.58,"comes"],
  [532.5,202.58,556.26,214.58,"from"],
  [367.2,214.58,398.13,226.58,"Traffic"],
  [400.84,214.58,434.6,226.58,"Impact"],
  [437.31,214.58,459.46,226.58,"Fees"],
  [462.17,214.58,486.87,226.58,"(TIF)."],
  [367.2,241.25,394.26,253.25,"O&M"],
  [396.97,241.25,423.05,253.25,"COST"],
  [425.76,241.25,503.23,253.25,"ASSUMPTIONS:"],
  [505.94,241.25,532.33,253.25,"O&M"],
  [535.05,241.25,559.86,253.25,"costs"],
  [367.2,253.25,384.04,265.25,"will"],
  [386.75,253.25,399.03,265.25,"be"],
  [401.74,253.25,472.07,265.25,"approximately"],
  [474.78,253.25,514.27,265.25,"$10,000"],
  [516.98,253.25,561.36,265.25,"annually."],
  [256.96,254.3,300.34,266.3,"PROJECT"],
  [303.05,254.3,355.02,266.3,"LOCATION"],
  [264.47,267.41,307.89,279.41,"Murrieta"],
  [310.6,267.41,347.52,279.41,"Avenue"],
  [277.59,279.41,295.95,291.41,"and"],
  [298.66,279.41,334.4,291.41,"Stanley"],
  [281.22,291.41,330.76,303.41,"Boulevard"],
  [34.56,302.56,81.74,318.56,"Project"],
  [85.36,302.56,165.84,318.56,"Description:"],
  [276.66,303.41,335.31,315.41,"Intersection"],
  [34.56,328.31,52.68,340.31,"The"],
  [55.4,328.31,90.15,340.31,"project"],
  [92.86,328.31,109.7,340.31,"will"],
  [112.41,328.31,142.33,340.31,"widen"],
  [145.04,328.31,161.33,340.31,"the"],
  [164.05,328.31,223.24,340.31,"southbound"],
  [225.96,328.31,271.95,340.31,"approach"],
  [34.56,340.31,44.91,352.31,"to"],
  [47.62,340.31,63.92,352.31,"the"],
  [66.63,340.31,110.05,352.31,"Murrieta"],
  [112.77,340.31,190.06,352.31,"Avenue/Stanley"],
  [192.77,340.31,242.31,352.31,"Boulevard"],
  [34.56,352.31,92.94,364.31,"intersection"],
  [95.65,352.31,114.01,364.31,"and"],
  [116.72,352.31,150.49,364.31,"extend"],
  [153.2,352.31,169.5,364.31,"the"],
  [172.21,352.31,231.41,364.31,"southbound"],
  [234.12,352.31,257.03,364.31,"right"],
  [34.56,364.31,55.37,376.31,"turn"],
  [58.09,364.31,81.89,376.31,"lane."],
  [34.56,493.11,81.74,509.11,"Project"],
  [85.36,493.11,169.75,509.11,"Justification:"],
  [34.56,525.14,52.68,537.14,"The"],
  [55.4,525.14,90.15,537.14,"project"],
  [92.86,525.14,100.31,537.14,"is"],
  [103.02,525.14,149.82,537.14,"identified"],
  [152.53,525.14,161.59,537.14,"in"],
  [164.3,525.14,180.6,537.14,"the"],
  [183.31,525.14,207.64,537.14,"2003"],
  [210.35,525.14,248.85,537.14,"General"],
  [251.57,525.14,272.57,537.14,"Plan"],
  [275.29,525.14,289.67,537.14,"TIF"],
  [292.38,525.14,330.03,537.14,"update,"],
  [332.74,525.14,351.1,537.14,"and"],
  [353.81,525.14,370.11,537.14,"the"],
  [372.82,525.14,426.65,537.14,"Downtown"],
  [429.36,525.14,466.47,537.14,"Specific"],
  [469.18,525.14,490.19,537.14,"Plan"],
  [492.9,525.14,503.25,537.14,"to"],
  [505.96,525.14,547.64,537.14,"enhance"],
  [34.56,537.14,92.94,549.14,"intersection"],
  [95.65,537.14,151.31,549.14,"operations."],
  [154.03,537.14,172.15,549.14,"The"],
  [174.86,537.14,233.24,549.14,"intersection"],
  [235.95,537.14,245.94,549.14,"of"],
  [248.66,537.14,292.08,549.14,"Murrieta"],
  [294.79,537.14,372.08,549.14,"Avenue/Stanley"],
  [374.8,537.14,424.34,549.14,"Boulevard"],
  [427.05,537.14,471.28,549.14,"currently"],
  [473.99,537.14,517.21,549.14,"operates"],
  [519.92,537.14,529.69,549.14,"at"],
  [532.4,537.14,554.61,549.14,"near"],
  [34.56,549.14,74.71,561.14,"capacity"],
  [77.43,549.14,108.93,561.14,"during"],
  [111.64,549.14,127.94,561.14,"the"],
  [130.65,549.14,171.76,561.14,"morning"],
  [174.47,549.14,224.37,561.14,"commute."],
  [227.08,549.14,246.68,561.14,"This"],
  [249.39,549.14,284.15,561.14,"project"],
  [286.86,549.14,303.7,561.14,"will"],
  [306.41,549.14,327.75,561.14,"help"],
  [330.46,549.14,364.27,561.14,"reduce"],
  [366.98,549.14,390.46,561.14,"peak"],
  [393.17,549.14,416.29,561.14,"hour"],
  [419.01,549.14,448.11,561.14,"traffic"],
  [450.82,549.14,504.25,561.14,"congestion"],
  [506.96,549.14,516.73,561.14,"at"],
  [519.44,549.14,537.21,561.14,"this"],
  [34.56,561.14,92.94,573.14,"intersection"],
  [95.65,561.14,114.01,573.14,"and"],
  [116.72,561.14,133.56,573.14,"will"],
  [136.27,561.14,177.95,573.14,"enhance"],
  [180.66,561.14,239.04,573.14,"intersection"],
  [241.75,561.14,294.39,573.14,"operations"],
  [297.1,561.14,315.46,573.14,"and"],
  [318.17,561.14,358.67,573.14,"mitigate"],
  [361.38,561.14,384.8,573.14,"sight"],
  [387.52,561.14,428.39,573.14,"distance"],
  [431.1,561.14,449.46,573.14,"and"],
  [452.17,561.14,492.72,573.14,"improve"],
  [495.43,561.14,528.79,573.14,"bicycle"],
  [531.51,561.14,549.86,573.14,"and"],
  [34.56,573.14,86.81,585.14,"pedestrian"],
  [89.53,573.14,132.7,585.14,"facilities,"],
  [135.42,573.14,171.6,585.14,"lighting"],
  [174.32,573.14,192.68,585.14,"and"],
  [195.39,573.14,235.19,585.14,"signage."],
  [115.2,620.47,135.88,630.46,"Fund"],
  [167.46,620.47,210.7,630.46,"FY2024-25"],
  [218.29,620.47,261.53,630.46,"FY2025-26"],
  [271.1,620.47,314.34,630.46,"FY2026-27"],
  [323.9,620.47,367.15,630.46,"FY2027-28"],
  [376.71,620.47,419.95,630.46,"FY2028-29"],
  [429.52,620.47,472.76,630.46,"FY2029-30"],
  [482.33,620.47,525.57,630.46,"FY2030-45"],
  [546.17,620.47,567.35,630.46,"Total"],
  [89.07,637.72,114.84,647.71,"Traffic"],
  [117.1,637.72,145.22,647.71,"Impact"],
  [147.48,637.72,162.02,647.71,"Fee"],
  [36.26,639.21,79.64,651.21,"PROJECT"],
  [184.02,644.47,194.15,654.46,"$0"],
  [234.83,644.47,244.97,654.46,"$0"],
  [287.64,644.47,297.78,654.46,"$0"],
  [326.54,644.47,364.5,654.46,"$150,000"],
  [379.35,644.47,417.31,654.46,"$150,000"],
  [432.16,644.47,470.12,654.46,"$150,000"],
  [498.88,644.47,509.01,654.46,"$0"],
  [537.73,644.47,575.78,654.46,"$450,000"],
  [34.18,651.21,81.74,663.21,"FUNDING"],
  [116.52,651.22,134.57,661.21,"(TIF)"],
  [112.07,668.47,139.02,678.46,"TOTAL"],
  [184.02,668.47,194.15,678.46,"$0"],
  [234.83,668.47,244.97,678.46,"$0"],
  [287.64,668.47,297.78,678.46,"$0"],
  [326.49,668.47,364.54,678.46,"$150,000"],
  [379.3,668.47,417.35,678.46,"$150,000"],
  [432.11,668.47,470.16,678.46,"$150,000"],
  [498.88,668.47,509.01,678.46,"$0"],
  [537.73,668.47,575.78,678.46,"$450,000"],
  [192.28,754.56,204.02,766.56,"FY"],
  [206.73,754.56,259.06,766.56,"2025-2030"],
  [261.78,754.56,303.27,766.56,"CAPITAL"],
  [305.99,754.56,384.07,766.56,"IMPROVEMENT"],
  [386.78,754.56,413.42,766.56,"PLAN"],
  [565.62,754.56,583.87,766.56,"159"]
 ]
}
