{
 "doc_id": "livermore-cip-fy2026-2030",
 "height": 792.0,
 "page": 98,
 "schema_version": 1,
 "width": 612.0,
 "words": [
  [7.26,22.37,61.27,40.37,"STREET"],
  [65.34,22.37,171.42,40.37,"RESURFACING"],
  [426.24,22.45,474.63,36.45,"CAPITAL"],
  [477.8,22.45,568.86,36.45,"IMPROVEMENT"],
  [572.03,22.45,603.09,36.45,"PLAN"],
  [7.26,40.37,41.91,52.37,"Project"],
  [44.62,40.37,64.94,52.37,"No.:"],
  [67.65,40.37,119.92,52.37,"SM202201"],
  [507.93,40.65,537.61,52.65,"Street"],
  [540.33,40.65,604.78,52.65,"Maintenance"],
  [367.2,124.48,433.76,136.48,"COMMUNITY"],
  [436.47,124.48,473.54,136.48,"PILLAR:"],
  [476.26,124.48,483.2,136.48,"A"],
  [485.92,124.48,504.52,136.48,"City"],
  [507.23,124.48,529.15,136.48,"That"],
  [531.87,124.48,563.2,136.48,"Works"],
  [367.2,152.68,398.62,164.68,"GOAL:"],
  [401.34,152.68,416.71,164.68,"14:"],
  [419.42,152.68,462.55,164.68,"Develop,"],
  [465.26,152.68,506.78,164.68,"operate,"],
  [509.49,152.68,527.85,164.68,"and"],
  [367.2,164.68,410.42,176.68,"maintain"],
  [413.13,164.68,429.43,176.68,"the"],
  [432.14,164.68,458.08,176.68,"City's"],
  [460.8,164.68,531.23,176.68,"infrastructure."],
  [367.2,195.06,418.07,207.06,"FUNDING:"],
  [420.78,195.06,455.43,207.06,"Project"],
  [458.14,195.06,495.43,207.06,"funding"],
  [498.14,195.06,529.79,207.06,"comes"],
  [532.5,195.06,556.26,207.06,"from"],
  [367.2,207.06,392.47,219.06,"State"],
  [395.18,207.06,398.86,219.06,"-"],
  [401.57,207.06,422.72,219.06,"SB1."],
  [367.2,234.21,394.26,246.21,"O&M"],
  [396.97,234.21,423.05,246.21,"COST"],
  [425.76,234.21,503.23,246.21,"ASSUMPTIONS:"],
  [505.94,234.21,534.22,246.21,"There"],
  [536.93,234.21,552.84,246.21,"are"],
  [367.2,246.21,379.83,258.21,"no"],
  [382.55,246.21,431.57,258.21,"additional"],
  [434.28,246.21,459.09,258.21,"costs"],
  [461.8,246.21,475.97,258.21,"for"],
  [478.69,246.21,496.46,258.21,"this"],
  [499.17,246.21,536.95,258.21,"project."],
  [248.56,260.46,291.93,272.46,"PROJECT"],
  [294.65,260.46,346.62,272.46,"LOCATION"],
  [251.66,277.03,292.78,289.03,"Multiple"],
  [295.49,277.03,339.5,289.03,"locations"],
  [275.13,289.03,316.02,301.03,"citywide"],
  [34.56,483.46,81.74,499.46,"Project"],
  [85.36,483.46,165.84,499.46,"Description:"],
  [34.56,508.56,54.16,520.56,"This"],
  [56.87,508.56,91.62,520.56,"project"],
  [94.34,508.56,111.18,520.56,"will"],
  [113.89,508.56,170.42,520.56,"rehabilitate"],
  [173.13,508.56,201.49,520.56,"seven"],
  [204.21,508.56,232.92,520.56,"major"],
  [235.64,508.56,282.52,520.56,"segments"],
  [285.24,508.56,295.23,520.56,"of"],
  [297.94,508.56,325.2,520.56,"roads"],
  [327.91,508.56,376.48,520.56,"consisting"],
  [379.2,508.56,389.19,520.56,"of"],
  [391.9,508.56,418.35,520.56,"three"],
  [421.06,508.56,456.42,520.56,"arterial"],
  [459.14,508.56,486.39,520.56,"roads"],
  [489.11,508.56,507.46,520.56,"and"],
  [510.18,508.56,530.66,520.56,"four"],
  [533.37,508.56,575.85,520.56,"collector"],
  [34.56,520.56,61.82,532.56,"roads"],
  [64.53,520.56,102.11,532.56,"totaling"],
  [104.82,520.56,175.15,532.56,"approximately"],
  [177.86,520.56,205.19,532.56,"9,293"],
  [207.9,520.56,237.9,532.56,"Linear"],
  [240.62,520.56,262.09,532.56,"Feet"],
  [264.8,520.56,282.64,532.56,"(LF)"],
  [285.35,520.56,295.34,532.56,"of"],
  [298.06,520.56,320.62,532.56,"road"],
  [323.33,520.56,375.67,532.56,"centerline."],
  [378.38,520.56,396.51,532.56,"The"],
  [399.22,520.56,470.34,532.56,"improvements"],
  [473.05,520.56,489.89,532.56,"will"],
  [492.6,520.56,528.07,532.56,"include"],
  [530.78,520.56,553.5,532.56,"base"],
  [34.56,532.56,71.39,544.56,"repairs,"],
  [74.1,532.56,109.68,544.56,"asphalt"],
  [112.39,532.56,155.32,544.56,"concrete"],
  [158.03,532.56,178.65,544.56,"(AC)"],
  [181.36,532.56,220.19,544.56,"overlay,"],
  [222.9,532.56,243.76,544.56,"new"],
  [246.47,532.56,295.79,544.56,"pavement"],
  [298.51,532.56,338.16,544.56,"striping,"],
  [340.88,532.56,359.23,544.56,"and"],
  [361.95,532.56,416.13,544.56,"installation"],
  [418.84,532.56,428.83,544.56,"of"],
  [431.54,532.56,452.4,544.56,"new"],
  [455.11,532.56,489.36,544.56,"vehicle"],
  [492.07,532.56,538.82,544.56,"detection"],
  [541.53,532.56,582.53,544.56,"cameras"],
  [34.56,544.56,56.22,556.56,"with"],
  [58.93,544.56,105.7,556.56,"upgraded"],
  [108.41,544.56,161.93,556.56,"equipment"],
  [164.64,544.56,174.99,556.56,"to"],
  [177.7,544.56,196.31,556.56,"one"],
  [199.02,544.56,228.12,556.56,"traffic"],
  [230.84,544.56,278.51,556.56,"signalized"],
  [281.22,544.56,339.6,556.56,"intersection"],
  [342.31,544.56,361.44,556.56,"(Las"],
  [364.15,544.56,398.59,556.56,"Positas"],
  [401.3,544.56,426.19,556.56,"Road"],
  [428.91,544.56,438.68,556.56,"at"],
  [441.39,544.56,475.49,556.56,"Hilliker"],
  [478.2,544.56,510.62,556.56,"Place)."],
  [513.33,544.56,531.45,556.56,"The"],
  [534.17,544.56,583.49,556.56,"pavement"],
  [34.56,556.56,71.22,568.56,"striping"],
  [73.94,556.56,90.77,568.56,"will"],
  [93.49,556.56,128.95,568.56,"include"],
  [131.67,556.56,152.15,568.56,"bike"],
  [154.86,556.56,175.64,568.56,"lane"],
  [178.35,556.56,196.71,568.56,"and"],
  [199.43,556.56,246.93,568.56,"crosswalk"],
  [249.65,556.56,320.77,568.56,"improvements"],
  [323.48,556.56,339.94,568.56,"per"],
  [342.65,556.56,358.95,568.56,"the"],
  [361.66,556.56,398.24,568.56,"Bicycle,"],
  [400.95,556.56,456.1,568.56,"Pedestrian,"],
  [458.81,556.56,477.17,568.56,"and"],
  [479.88,556.56,505.86,568.56,"Trails"],
  [508.57,556.56,538.75,568.56,"Active"],
  [34.56,568.56,107.33,580.56,"Transportation"],
  [110.04,568.56,134.08,580.56,"Plan."],
  [136.79,568.56,156.39,580.56,"This"],
  [159.1,568.56,193.85,580.56,"project"],
  [196.57,568.56,204.01,580.56,"is"],
  [206.73,568.56,256.41,580.56,"scheduled"],
  [259.12,568.56,269.47,580.56,"to"],
  [272.18,568.56,284.46,580.56,"be"],
  [287.17,568.56,339.48,580.56,"completed"],
  [342.19,568.56,351.25,580.56,"in"],
  [353.97,568.56,365.33,580.56,"FY"],
  [368.04,568.56,411.24,580.56,"2024-25."],
  [34.56,587.29,81.74,603.29,"Project"],
  [85.36,587.29,169.75,603.29,"Justification:"],
  [34.56,607.51,54.16,619.51,"This"],
  [56.87,607.51,91.62,619.51,"project"],
  [94.34,607.51,111.18,619.51,"will"],
  [113.89,607.51,147.66,619.51,"extend"],
  [150.37,607.51,166.67,619.51,"the"],
  [169.38,607.51,184.52,619.51,"life"],
  [187.23,607.51,197.22,619.51,"of"],
  [199.94,607.51,216.23,619.51,"the"],
  [218.94,607.51,241.51,619.51,"road"],
  [244.22,607.51,269.35,619.51,"asset"],
  [272.06,607.51,290.42,619.51,"and"],
  [293.13,607.51,333.68,619.51,"improve"],
  [336.39,607.51,365.88,619.51,"public"],
  [368.6,607.51,398.12,619.51,"safety"],
  [400.84,607.51,412.57,619.51,"by"],
  [415.28,607.51,469.88,619.51,"eliminating"],
  [472.6,607.51,495.16,619.51,"road"],
  [497.87,607.51,535.6,619.51,"hazards"],
  [538.31,607.51,587.64,619.51,"(potholes,"],
  [34.56,619.51,76.34,631.51,"standing"],
  [79.05,619.51,110.54,631.51,"water,"],
  [113.26,619.51,136.31,631.51,"dips,"],
  [139.02,619.51,175.21,631.51,"bumps,"],
  [177.92,619.51,238.74,631.51,"undulations,"],
  [241.45,619.51,266.21,631.51,"etc.)."],
  [114.84,649.59,135.52,659.59,"Fund"],
  [166.57,649.59,209.81,659.59,"FY2024-25"],
  [216.65,649.59,259.89,659.59,"FY2025-26"],
  [268.26,649.59,311.5,659.59,"FY2026-27"],
  [319.88,649.59,363.12,659.59,"FY2027-28"],
  [371.49,649.59,414.74,659.59,"FY2028-29"],
  [424.67,649.59,467.91,659.59,"FY2029-30"],
  [479.42,649.59,522.66,659.59,"FY2030-45"],
  [545.19,649.59,566.37,659.59,"Total"],
  [36.26,660.84,79.64,672.84,"PROJECT"],
  [103.31,666.84,124.36,676.84,"State"],
  [126.61,666.84,129.68,676.84,"-"],
  [131.94,666.84,147.03,676.84,"SB1"],
  [165.43,666.84,210.94,676.84,"$3,500,000"],
  [233.2,666.84,243.33,676.84,"$0"],
  [284.81,666.84,294.95,676.84,"$0"],
  [336.43,666.84,346.56,676.84,"$0"],
  [388.04,666.84,398.18,676.84,"$0"],
  [441.23,666.84,451.36,676.84,"$0"],
  [495.97,666.84,506.11,676.84,"$0"],
  [532.95,666.84,578.64,676.84,"$3,500,000"],
  [34.18,672.84,81.74,684.84,"FUNDING"],
  [111.7,684.09,138.64,694.09,"TOTAL"],
  [165.35,684.09,211.04,694.09,"$3,500,000"],
  [233.2,684.09,243.33,694.09,"$0"],
  [284.81,684.09,294.95,694.09,"$0"],
  [336.43,684.09,346.56,694.09,"$0"],
  [388.04,684.09,398.18,694.09,"$0"],
  [441.23,684.09,451.36,694.09,"$0"],
  [495.97,684.09,506.11,694.09,"$0"],
  [532.95,684.09,578.64,694.09,"$3,500,000"],
  [192.28,754.56,204.02,766.56,"FY"],
  [206.73,754.56,259.06,766.56,"2025-2030"],
  [261.78,754.56,303.27,766.56,"CAPITAL"],
  [305.99,754.56,384.07,766.56,"IMPROVEMENT"],
  [386.78,754.56,413.42,766.56,"PLAN"],
  [568.67,754.56,580.84,766.56,"94"]
 ]
}
