{
 "doc_id": "livermore-cip-fy2026-2030",
 "height": 792.0,
 "page": 41,
 "schema_version": 1,
 "width": 612.0,
 "words": [
  [426.14,22.17,474.54,36.17,"CAPITAL"],
  [477.7,22.17,568.76,36.17,"IMPROVEMENT"],
  [571.93,22.17,602.99,36.17,"PLAN"],
  [7.26,25.42,73.32,43.41,"DOOLAN"],
  [77.39,25.42,117.85,43.41,"PARK"],
  [121.92,25.42,210.93,43.41,"LANDSCAPE"],
  [215.0,25.42,341.01,43.41,"REHABILITATION"],
  [496.87,40.65,523.15,52.65,"Parks"],
  [525.86,40.65,534.05,52.65,"&"],
  [536.76,40.65,604.73,52.65,"Beautification"],
  [7.26,42.83,41.89,54.83,"Project"],
  [44.6,42.83,64.9,54.83,"No.:"],
  [67.61,42.83,116.81,54.83,"PB200429"],
  [367.2,130.27,433.76,142.27,"COMMUNITY"],
  [436.47,130.27,473.54,142.27,"PILLAR:"],
  [476.26,130.27,483.2,142.27,"A"],
  [485.92,130.27,504.52,142.27,"City"],
  [507.23,130.27,529.15,142.27,"That"],
  [531.87,130.27,563.2,142.27,"Works"],
  [367.2,156.67,398.62,168.67,"GOAL:"],
  [401.34,156.67,416.71,168.67,"14:"],
  [419.42,156.67,462.55,168.67,"Develop,"],
  [465.26,156.67,506.78,168.67,"operate,"],
  [509.49,156.67,527.85,168.67,"and"],
  [367.2,168.67,410.42,180.67,"maintain"],
  [413.13,168.67,429.43,180.67,"the"],
  [432.14,168.67,458.43,180.67,"City’s"],
  [461.14,168.67,531.58,180.67,"infrastructure."],
  [367.2,195.07,418.07,207.07,"FUNDING:"],
  [420.78,195.07,455.43,207.07,"Project"],
  [458.14,195.07,495.43,207.07,"funding"],
  [498.14,195.07,529.79,207.07,"comes"],
  [532.5,195.07,556.26,207.07,"from"],
  [367.2,207.07,388.79,219.07,"Park"],
  [391.5,207.07,416.68,219.07,"Fees."],
  [367.2,233.47,394.26,245.47,"O&M"],
  [396.97,233.47,423.05,245.47,"COST"],
  [425.76,233.47,503.23,245.47,"ASSUMPTIONS:"],
  [505.94,233.47,532.33,245.47,"O&M"],
  [535.05,233.47,559.86,245.47,"costs"],
  [367.2,245.47,384.04,257.47,"will"],
  [386.75,245.47,399.03,257.47,"be"],
  [401.74,245.47,472.07,257.47,"approximately"],
  [474.78,245.47,508.19,257.47,"$2,000"],
  [510.9,245.47,555.28,257.47,"annually."],
  [253.54,282.25,296.92,294.25,"PROJECT"],
  [299.63,282.25,351.6,294.25,"LOCATION"],
  [263.56,299.74,304.47,311.74,"Junction"],
  [307.19,299.74,344.1,311.74,"Avenue"],
  [266.08,311.74,275.85,323.74,"at"],
  [278.56,311.74,301.96,323.74,"Ladd"],
  [304.67,311.74,341.59,323.74,"Avenue"],
  [34.56,316.32,81.74,332.32,"Project"],
  [85.36,316.32,165.84,332.32,"Description:"],
  [34.56,342.92,52.68,354.92,"The"],
  [55.4,342.92,90.15,354.92,"project"],
  [92.86,342.92,159.45,354.92,"complements"],
  [162.17,342.92,180.52,354.92,"and"],
  [183.24,342.92,233.94,354.92,"completes"],
  [236.65,342.92,252.94,354.92,"the"],
  [34.56,354.92,100.51,366.92,"rehabilitation"],
  [103.22,354.92,113.21,366.92,"of"],
  [115.92,354.92,150.77,366.92,"Doolan"],
  [153.48,354.92,175.07,366.92,"Park"],
  [177.78,354.92,187.55,366.92,"at"],
  [190.26,354.92,231.18,366.92,"Junction"],
  [233.89,354.92,270.8,366.92,"Avenue"],
  [273.52,354.92,307.86,366.92,"Middle"],
  [34.56,366.92,66.86,378.92,"School"],
  [69.58,366.92,81.31,378.92,"by"],
  [84.02,366.92,127.76,378.92,"installing"],
  [130.47,366.92,142.52,378.92,"an"],
  [145.24,366.92,189.92,378.92,"irrigation"],
  [192.63,366.92,227.02,378.92,"system"],
  [229.74,366.92,264.91,378.92,"around"],
  [267.62,366.92,283.92,378.92,"the"],
  [34.56,378.92,83.5,390.92,"perimeter"],
  [86.22,378.92,96.21,390.92,"of"],
  [98.92,378.92,115.21,390.92,"the"],
  [117.93,378.92,139.62,390.92,"park"],
  [142.33,378.92,160.69,390.92,"and"],
  [163.4,378.92,197.99,390.92,"placing"],
  [200.7,378.92,258.55,390.92,"appropriate"],
  [261.27,378.92,286.4,390.92,"plant"],
  [34.56,390.92,83.01,402.92,"materials,"],
  [85.72,390.92,104.08,402.92,"and"],
  [106.79,390.92,112.54,402.92,"a"],
  [115.26,390.92,136.11,402.92,"new"],
  [138.82,390.92,160.51,402.92,"park"],
  [163.23,390.92,185.66,402.92,"sign."],
  [188.37,390.92,252.83,402.92,"Maintenance"],
  [255.54,390.92,277.33,402.92,"staff"],
  [280.04,390.92,296.88,402.92,"will"],
  [34.56,402.92,59.1,414.92,"work"],
  [61.82,402.92,83.47,414.92,"with"],
  [86.19,402.92,142.14,414.92,"contractors"],
  [144.86,402.92,155.2,414.92,"to"],
  [157.92,402.92,198.14,414.92,"perform"],
  [200.85,402.92,228.42,414.92,"work."],
  [34.56,511.1,81.74,527.1,"Project"],
  [85.36,511.1,169.75,527.1,"Justification:"],
  [34.56,538.09,76.41,550.09,"Previous"],
  [79.13,538.09,118.57,550.09,"projects"],
  [121.28,538.09,163.06,550.09,"included"],
  [165.77,538.09,171.52,550.09,"a"],
  [174.23,538.09,203.27,550.09,"newly"],
  [205.98,538.09,256.23,550.09,"renovated"],
  [258.94,538.09,273.31,550.09,"tot"],
  [276.02,538.09,289.13,550.09,"lot"],
  [291.84,538.09,312.08,550.09,"play"],
  [314.79,538.09,336.44,550.09,"area"],
  [339.15,538.09,359.25,550.09,"that"],
  [361.96,538.09,369.41,550.09,"is"],
  [372.12,538.09,393.39,550.09,"ADA"],
  [396.1,538.09,448.13,550.09,"accessible,"],
  [450.85,538.09,471.7,550.09,"new"],
  [474.41,538.09,518.03,550.09,"benches,"],
  [520.74,538.09,550.23,550.09,"tables"],
  [552.94,538.09,571.3,550.09,"and"],
  [34.56,550.09,73.81,562.09,"garbage"],
  [76.52,550.09,127.91,562.09,"containers"],
  [130.62,550.09,158.23,562.09,"made"],
  [160.94,550.09,184.7,562.09,"from"],
  [187.41,550.09,228.18,562.09,"recycled"],
  [230.89,550.09,279.34,562.09,"materials,"],
  [282.05,550.09,300.41,562.09,"and"],
  [303.12,550.09,308.87,562.09,"a"],
  [311.59,550.09,340.62,562.09,"newly"],
  [343.34,550.09,393.59,562.09,"renovated"],
  [396.3,550.09,441.62,562.09,"walkway."],
  [444.34,550.09,463.94,562.09,"This"],
  [466.65,550.09,491.19,562.09,"work"],
  [493.91,550.09,510.75,562.09,"will"],
  [513.46,550.09,548.09,562.09,"further"],
  [550.8,550.09,569.16,562.09,"add"],
  [571.87,550.09,582.22,562.09,"to"],
  [34.56,562.09,50.85,574.09,"the"],
  [53.57,562.09,78.11,574.09,"work"],
  [80.83,562.09,130.97,574.09,"previously"],
  [133.68,562.09,189.02,574.09,"completed."],
  [191.74,562.09,209.86,574.09,"The"],
  [212.57,562.09,234.27,574.09,"park"],
  [236.98,562.09,281.2,574.09,"currently"],
  [283.92,562.09,313.16,574.09,"needs"],
  [315.87,562.09,336.73,574.09,"new"],
  [339.44,562.09,394.75,574.09,"playground"],
  [397.47,562.09,419.16,574.09,"bark"],
  [421.87,562.09,431.64,574.09,"at"],
  [434.35,562.09,498.75,574.09,"$5,000-7,000"],
  [501.46,562.09,511.81,574.09,"to"],
  [514.52,562.09,540.07,574.09,"meet"],
  [34.56,574.09,89.87,586.09,"playground"],
  [92.59,574.09,122.11,586.09,"safety"],
  [124.82,574.09,175.85,586.09,"standards."],
  [112.2,623.27,133.11,633.38,"Fund"],
  [162.15,623.27,205.88,633.38,"FY2024-25"],
  [213.98,623.27,257.71,633.38,"FY2025-26"],
  [267.42,623.27,311.14,633.38,"FY2026-27"],
  [320.85,623.27,364.57,633.38,"FY2027-28"],
  [374.28,623.27,418.0,633.38,"FY2028-29"],
  [427.71,623.27,471.44,633.38,"FY2029-30"],
  [481.14,623.27,524.87,633.38,"FY2030-45"],
  [545.73,623.27,567.14,633.38,"Total"],
  [36.26,635.15,79.64,647.15,"PROJECT"],
  [103.1,640.71,121.28,650.82,"Park"],
  [123.57,640.71,142.22,650.82,"Fees"],
  [178.88,640.71,189.13,650.82,"$0"],
  [230.73,640.71,240.97,650.82,"$0"],
  [270.08,640.71,308.47,650.82,"$240,000"],
  [337.59,640.71,347.84,650.82,"$0"],
  [391.02,640.71,401.27,650.82,"$0"],
  [444.46,640.71,454.7,650.82,"$0"],
  [497.89,640.71,508.13,650.82,"$0"],
  [537.21,640.71,575.68,650.82,"$240,000"],
  [34.18,647.15,81.74,659.15,"FUNDING"],
  [109.04,658.15,136.28,668.26,"TOTAL"],
  [178.88,658.15,189.13,668.26,"$0"],
  [230.73,658.15,240.97,668.26,"$0"],
  [270.05,658.15,308.52,668.26,"$240,000"],
  [337.59,658.15,347.84,668.26,"$0"],
  [391.02,658.15,401.27,668.26,"$0"],
  [444.46,658.15,454.7,668.26,"$0"],
  [497.89,658.15,508.13,668.26,"$0"],
  [537.21,658.15,575.68,668.26,"$240,000"],
  [192.28,754.56,204.02,766.56,"FY"],
  [206.73,754.56,259.06,766.56,"2025-2030"],
  [261.78,754.56,303.27,766.56,"CAPITAL"],
  [305.99,754.56,384.07,766.56,"IMPROVEMENT"],
  [386.78,754.56,413.42,766.56,"PLAN"],
  [568.67,754.56,580.84,766.56,"37"]
 ]
}
